timestamp,device_id,temperatura_c,vibracion_ms2,estado,linea_produccion
30/12/2025 23:27,SENSOR-006,39.66,22.123,0,a
01/01/2026 01:03,SENSOR-045,25.09,3.028,0,línea C
2026-01-10 14:57:20,SENSOR-043,"68,45",30.846,OK,Linea B
2026-01-01 15:45:09,SENSOR-039,56.06,4.475,NORMAL,línea C
25/01/2026 11:00,SENSOR-033,66.48,4.577,ok,Linea B
2025-12-30 14:06:44,SENSOR-047,56.52,0.532,OK,b
2026-01-14T12:18:25,SENSOR-004,79.55,1.244,ok,línea A
2026-01-08 09:22:26,SENSOR-001,35.62,1.432,NORMAL,A
23/01/2026 23:44,SENSOR-046,"48,83",0.46,NORMAL,Linea A
2026-01-03 05:09:54,SENSOR-049,"47,77",0.903,FAIL,c
2026-01-08T12:45:15,SENSOR-006,59.51,1.6,1,Linea B
2026-01-08T10:23:30,SENSOR-008,69.13,0.766,0,línea B
2026-01-05 19:03:33,SENSOR-011,72.93,2.551,0,Linea A
2025-12-29T11:53:40,SENSOR-016,42.71,8.708,ok,a
2026-01-11 12:03:36,SENSOR-039,43.76,41.425,NORMAL,línea B
2026-01-01T01:03:24,SENSOR-037,61.51,4.632,OK,línea C
2026-01-16 08:35:47,SENSOR-045,72.39,2.162,NORMAL,b
31/12/2025 12:12,SENSOR-004,45.64,43.549,OK,B
2026-01-07T21:22:19,SENSOR-021,45.93,2.381,0,línea A
2026-01-11T20:57:59,SENSOR-037,77.18,4.623,OK,A
2026-01-01T01:03:24,SENSOR-037,61.51,4.632,OK,línea C
2026-01-25T14:05:43,SENSOR-003,54.81,4.715,OK,Linea B
2026-01-01 05:26:55,SENSOR-021,37.52,17.901,ERROR,B
2026-01-02T16:35:27,SENSOR-011,39.82,2.703,NORMAL,b
2026-01-22 02:38:36,SENSOR-029,55.66,4.618,NORMAL,línea B
30/12/2025 01:35,SENSOR-049,53.45,4.655,FAIL,a
2026-01-25 18:43:12,SENSOR-001,"42,71",16.169,Alerta,Linea C
2026-01-15 14:52:43,SENSOR-019,70.2,1.872,ok,b
06/01/2026 09:42,SENSOR-026,46.45,0.309,OK,A
23/01/2026 13:52,SENSOR-036,49.48,2.014,OK,Linea C
2026-01-21T12:03:25,SENSOR-014,,0.718,OK,A
2026-01-08 17:06:03,SENSOR-015,76.53,0.843,OK,A
2026-01-22 11:38:09,SENSOR-016,48.72,0.147,NORMAL,b
2026-01-04T14:41:57,SENSOR-005,38.73,0.104,1,Linea B
16/01/2026 16:15,SENSOR-003,44.24,1.818,0,línea A
14/01/2026 05:51,SENSOR-029,144.02,2.055,ok,Linea A
22/01/2026 16:55,SENSOR-042,196.45,3.671,ok,Linea A
2026-01-07T20:49:52,SENSOR-039,31.67,4.582,0,B
2026-01-10T08:59:23,SENSOR-008,31.65,4.025,1,b
2026-01-08 09:22:26,SENSOR-001,35.62,1.432,NORMAL,A
21/01/2026 12:34,SENSOR-025,73.66,4.119,OK,b
13/01/2026 18:53,SENSOR-009,29.61,3.909,0,A
18/01/2026 23:23,SENSOR-018,60.1,1.621,0,a
2026-01-17 14:15:21,SENSOR-028,"27,47",4.86,OK,c
18/01/2026 09:46,SENSOR-038,,3.62,1,a
2026-01-25T02:36:45,SENSOR-020,"36,45",28.687,FAIL,línea B
2026-01-13T00:04:35,SENSOR-012,47.26,0.528,ok,Linea C
2026-01-18T11:26:24,SENSOR-017,71.45,4.64,OK,c
2026-01-09T15:59:50,SENSOR-039,75.07,2.801,0,Linea B
2025-12-30T08:56:02,SENSOR-049,57.26,0.929,OK,Linea B
2026-01-21 01:24:46,SENSOR-007,,1.234,ok,C
2026-01-03T20:52:47,SENSOR-049,59.49,4.695,NORMAL,Linea C
2026-01-23 00:44:42,SENSOR-016,"64,2",3.892,OK,a
2026-01-25T19:42:00,SENSOR-044,69.51,27.938,NORMAL,C
18/01/2026 03:48,SENSOR-044,"49,13",4.407,OK,línea C
2026-01-03 12:55:58,SENSOR-021,"25,8",0.0,ok,línea C
2026-01-08T13:09:16,SENSOR-045,37.85,1.091,NORMAL,B
2026-01-10 04:03:03,SENSOR-018,,1.623,ok,A
2025-12-31 15:01:39,SENSOR-039,48.12,1.023,0,línea C
12/01/2026 02:41,SENSOR-005,76.6,3.493,ok,A
2026-01-15T15:04:22,SENSOR-029,81.72,0.353,Alerta,Linea B
08/01/2026 11:46,SENSOR-039,26.48,4.144,1,Linea C
04/01/2026 02:27,SENSOR-024,"66,48",0.863,NORMAL,c
2026-01-01 02:08:53,SENSOR-013,68.39,4.057,0,línea A
2026-01-17T06:11:49,SENSOR-021,56.01,0.381,NORMAL,Linea C
29/12/2025 19:45,SENSOR-012,39.86,4.891,OK,línea B
2026-01-09 00:04:10,SENSOR-011,57.33,0.0,ok,línea A
2026-01-05T06:54:54,SENSOR-013,"57,34",46.833,NORMAL,a
2026-01-14T09:05:47,SENSOR-043,42.92,1.156,NORMAL,b
2026-01-20T03:19:45,SENSOR-004,38.04,15.764,NORMAL,Linea A
2026-01-25T16:18:55,SENSOR-032,48.75,11.553,NORMAL,c
2026-01-17T14:15:41,SENSOR-013,34.28,0.563,OK,línea B
2026-01-28 04:27:57,SENSOR-040,64.49,1.332,ok,a
2026-01-27T07:49:51,SENSOR-046,76.11,1.009,OK,Linea B
2026-01-17T07:46:05,SENSOR-002,43.38,2.392,NORMAL,Linea B
2026-01-05 09:51:13,SENSOR-023,,1.41,OK,Linea A
12/01/2026 22:31,SENSOR-025,38.21,3.634,ok,línea C
03/01/2026 17:44,SENSOR-037,73.4,2.221,ok,b
2026-01-28 04:09:04,SENSOR-039,69.33,0.0,NORMAL,línea B
2026-01-11 17:47:53,SENSOR-002,69.19,3.872,warning,c
20/01/2026 23:10,SENSOR-036,45.99,0.0,0,A
30/12/2025 18:17,SENSOR-042,30.08,0.0,NORMAL,línea C
2026-01-02 10:45:43,SENSOR-010,48.54,4.557,0,a
2026-01-04 05:31:44,SENSOR-005,52.73,3.227,NORMAL,c
2026-01-06 02:30:21,SENSOR-003,53.42,17.656,ok,línea C
2026-01-08 23:25:57,SENSOR-005,123.11,2.246,OK,B
2026-01-06T13:54:52,SENSOR-050,61.07,3.865,1,línea C
2026-01-11T10:59:54,SENSOR-020,43.18,3.853,NORMAL,Linea B
2026-01-11T00:52:56,SENSOR-005,32.94,1.867,ok,Linea A
2026-01-08 23:25:57,SENSOR-005,123.11,2.246,OK,B
2026-01-01T16:49:55,SENSOR-009,48.95,1.955,OK,a
2025-12-31 07:29:11,SENSOR-016,52.41,2.047,FAIL,Linea C
2026-01-09T01:45:09,SENSOR-012,48.29,3.649,OK,línea A
01/01/2026 02:27,SENSOR-046,52.37,2.067,OK,Linea A
11/01/2026 10:32,SENSOR-016,"38,55",1.165,ok,c
2025-12-29T16:23:20,SENSOR-031,61.87,2.361,0,C
2026-01-14T11:57:06,SENSOR-035,55.57,0.517,ERROR,a
31/12/2025 15:20,SENSOR-024,193.83,1.628,1,línea A
19/01/2026 06:26,SENSOR-030,33.96,3.934,OK,línea A
2026-01-10T13:17:15,SENSOR-034,25.58,4.814,ok,a
2026-01-27T23:46:32,SENSOR-045,39.29,5.919,OK,línea B
2026-01-06T07:35:13,SENSOR-030,31.95,4.947,1,Linea C
2026-01-12T14:34:57,SENSOR-037,25.54,2.328,NORMAL,línea A
20/01/2026 23:01,SENSOR-020,66.69,35.132,OK,C
2026-01-08 10:55:10,SENSOR-031,19.14,4.79,1,a
2026-01-08T21:10:57,SENSOR-019,42.37,1.31,FAIL,línea C
2026-01-17T14:41:49,SENSOR-003,71.44,1.155,ok,c
27/01/2026 12:35,SENSOR-009,40.58,2.148,NORMAL,A
2026-01-24 22:45:07,SENSOR-046,48.97,3.872,ok,b
2025-12-30 14:06:44,SENSOR-047,56.52,0.532,OK,b
2026-01-11 00:17:56,SENSOR-028,146.57,1.048,ok,a
2026-01-19T22:38:54,SENSOR-036,"165,95",15.975,1,línea A
2026-01-18 18:43:32,SENSOR-045,,1.141,0,C
2026-01-09 13:48:38,SENSOR-019,52.47,3.089,NORMAL,Linea C
2026-01-05 11:43:55,SENSOR-050,57.16,45.053,OK,Linea A
31/12/2025 18:50,SENSOR-003,66.55,3.791,2,a
2026-01-24T18:38:21,SENSOR-036,44.02,1.175,ok,Linea A
2025-12-31T03:39:46,SENSOR-048,"57,15",2.232,0,línea C
2026-01-14T00:02:10,SENSOR-037,109.37,0.0,2,a
14/01/2026 13:42,SENSOR-044,36.38,4.189,warning,C
02/01/2026 19:37,SENSOR-038,56.41,2.437,WARN,Linea B
2026-01-18T01:59:45,SENSOR-005,"44,66",0.454,NORMAL,C
25/01/2026 21:22,SENSOR-035,59.33,14.752,NORMAL,A
21/01/2026 16:48,SENSOR-040,79.09,1.067,0,Linea C
2026-01-10T02:53:30,SENSOR-024,"193,91",3.188,0,b
2026-01-02T05:07:00,SENSOR-047,50.99,2.85,0,línea C
2026-01-27T16:01:27,SENSOR-028,66.68,3.119,NORMAL,c
13/01/2026 22:19,SENSOR-005,31.48,0.808,0,C
2026-01-17 07:43:58,SENSOR-023,31.09,0.368,ok,c
2026-01-22T11:33:51,SENSOR-011,"60,49",0.0,FAIL,Linea A
2026-01-10 00:34:20,SENSOR-031,43.97,4.64,WARN,B
2025-12-31 06:57:18,SENSOR-002,58.79,3.795,NORMAL,B
2026-01-02T11:42:22,SENSOR-011,46.41,2.635,WARN,B
2026-01-18T11:48:24,SENSOR-030,79.08,4.812,NORMAL,b
2026-01-08 21:44:36,SENSOR-023,28.39,3.745,0,Linea C
2026-01-24T13:24:02,SENSOR-005,74.42,3.635,0,Linea B
20/01/2026 15:09,SENSOR-015,43.48,1.265,ok,Linea C
2026-01-27T20:32:28,SENSOR-028,51.27,7.884,0,línea A
2026-01-18 11:36:08,SENSOR-018,32.41,0.846,0,b
07/01/2026 12:50,SENSOR-020,102.71,3.83,OK,A
2026-01-22 03:47:24,SENSOR-050,45.87,4.55,OK,B
2026-01-03T20:52:47,SENSOR-049,59.49,4.695,NORMAL,Linea C
2025-12-30T06:45:14,SENSOR-018,44.59,1.411,NORMAL,B
14/01/2026 02:06,SENSOR-027,43.84,3.124,NORMAL,Linea B
2026-01-24T13:41:44,SENSOR-041,44.65,3.623,0,C
13/01/2026 21:09,SENSOR-003,26.68,3.607,ok,C
20/01/2026 15:09,SENSOR-015,43.48,1.265,ok,Linea C
2026-01-02T12:46:56,SENSOR-008,57.55,4.23,Alerta,Linea C
2026-01-13T10:02:47,SENSOR-045,55.99,1.747,OK,Linea C
2026-01-14T19:24:16,SENSOR-031,73.87,1.705,OK,Linea B
2026-01-09T11:39:19,SENSOR-024,26.7,0.0,2,línea A
2026-01-25T05:27:49,SENSOR-033,,0.0,NORMAL,Linea C
08/01/2026 15:25,SENSOR-035,,1.926,0,Linea C
2026-01-06T14:17:09,SENSOR-025,66.37,3.705,0,línea A
2026-01-13 15:08:43,SENSOR-020,56.57,0.0,0,B
2026-01-04T12:07:51,SENSOR-049,,2.104,OK,línea C
2026-01-08T02:08:22,SENSOR-018,32.39,0.507,OK,línea A
2026-01-10T08:54:27,SENSOR-008,57.88,19.834,0,línea C
2026-01-26 14:02:26,SENSOR-017,30.58,3.047,ERROR,Linea A
2025-12-31T20:04:07,SENSOR-007,"20,35",2.499,ok,línea B
2026-01-04T07:48:59,SENSOR-019,28.88,2.482,NORMAL,línea A
2026-01-04T10:09:52,SENSOR-024,29.08,0.715,NORMAL,línea C
28/01/2026 06:17,SENSOR-034,40.82,1.734,0,A
23/01/2026 13:52,SENSOR-036,49.48,2.014,OK,Linea C
2026-01-25T03:17:26,SENSOR-007,"75,55",3.788,OK,Linea B
2026-01-04 06:22:21,SENSOR-024,"34,55",6.66,ok,C
2026-01-15 09:09:16,SENSOR-013,41.14,1.154,NORMAL,línea B
2025-12-31 23:10:49,SENSOR-019,38.08,3.216,NORMAL,línea C
2026-01-07 22:54:07,SENSOR-028,47.05,2.517,0,Linea B
08/01/2026 15:22,SENSOR-024,57.58,4.766,warning,línea A
2026-01-14T12:58:21,SENSOR-016,43.74,2.534,NORMAL,línea B
2026-01-26T07:39:28,SENSOR-007,71.17,1.209,OK,c
2026-01-22T16:26:08,SENSOR-027,71.39,2.744,0,Linea A
2026-01-14T10:22:13,SENSOR-022,"42,79",1.452,OK,Linea C
2026-01-22 00:25:09,SENSOR-010,31.07,0.0,0,a
2026-01-12T22:23:31,SENSOR-046,"67,01",4.768,fail,línea C
2026-01-20 07:43:42,SENSOR-029,41.43,4.988,NORMAL,c
2026-01-21T17:57:55,SENSOR-049,77.62,46.257,1,C
06/01/2026 03:08,SENSOR-039,"28,47",3.355,NORMAL,b
2026-01-23 09:41:28,SENSOR-021,"40,63",40.28,OK,b
15/01/2026 18:42,SENSOR-009,46.1,1.113,NORMAL,C
13/01/2026 00:31,SENSOR-046,48.61,0.147,NORMAL,c
10/01/2026 06:58,SENSOR-018,35.02,3.224,0,A
2026-01-05 03:34:46,SENSOR-046,"89,48",47.324,0,b
2026-01-13T10:38:49,SENSOR-009,51.99,4.413,ok,a
2026-01-02 04:45:17,SENSOR-040,5.99,1.522,NORMAL,C
2026-01-17 10:46:06,SENSOR-017,,4.453,ok,C
25/01/2026 09:11,SENSOR-050,30.96,3.552,WARN,b
2026-01-22T03:08:13,SENSOR-010,33.21,1.542,0,B
16/01/2026 16:36,SENSOR-011,76.92,3.914,warning,B
2026-01-13T05:51:47,SENSOR-010,51.45,2.371,ok,línea A
19/01/2026 07:26,SENSOR-005,34.38,0.745,NORMAL,a
2026-01-02 02:28:33,SENSOR-027,41.33,0.961,ok,A
2025-12-31 00:07:42,SENSOR-033,36.95,2.151,FAIL,A
2026-01-24T06:27:39,SENSOR-032,65.58,0.362,ok,línea B
09/01/2026 06:36,SENSOR-048,25.65,4.708,Alerta,Linea B
2026-01-18 11:42:01,SENSOR-045,70.97,3.297,OK,A
2026-01-11T00:45:24,SENSOR-025,45.21,0.472,0,Linea A
2026-01-09 04:44:04,SENSOR-038,"51,94",2.44,ok,B
2026-01-21 13:09:51,SENSOR-049,"39,89",0.0,Alerta,línea B
08/01/2026 17:29,SENSOR-033,35.16,4.199,0,línea B
2026-01-21T01:21:56,SENSOR-021,42.59,4.192,OK,Linea A
23/01/2026 01:25,SENSOR-031,72.39,2.71,ok,a
2026-01-03T20:15:42,SENSOR-001,70.62,1.626,ok,Linea C
2026-01-27T18:08:51,SENSOR-050,75.72,4.529,0,c
2025-12-31T06:43:00,SENSOR-044,40.34,3.915,OK,línea A
10/01/2026 21:17,SENSOR-043,41.72,0.464,ok,C
2025-12-31 15:01:39,SENSOR-039,48.12,1.023,0,línea C
13/01/2026 10:22,SENSOR-015,46.89,2.2,ok,a
23/01/2026 06:56,SENSOR-002,55.64,4.928,0,A
03/01/2026 16:32,SENSOR-043,36.62,4.589,WARN,c
2026-01-15T04:44:36,SENSOR-044,73.0,0.283,OK,C
09/01/2026 11:18,SENSOR-045,28.76,0.499,NORMAL,A
26/01/2026 01:22,SENSOR-008,25.88,2.272,NORMAL,B
2026-01-02 02:43:01,SENSOR-046,48.38,1.69,0,b
06/01/2026 09:32,SENSOR-009,25.89,0.167,NORMAL,línea A
23/01/2026 00:31,SENSOR-004,64.14,4.645,ok,Linea A
08/01/2026 01:59,SENSOR-030,77.19,2.686,NORMAL,línea B
2026-01-26T18:10:50,SENSOR-039,33.71,2.325,0,Linea C
2025-12-30 23:44:47,SENSOR-003,31.45,3.838,ok,Linea B
10/01/2026 01:27,SENSOR-016,79.78,2.497,OK,a
01/01/2026 15:56,SENSOR-039,"50,6",1.973,NORMAL,Linea A
2026-01-15T15:27:00,SENSOR-011,50.58,0.172,Alerta,Linea B
2026-01-27 07:11:28,SENSOR-015,35.87,36.971,0,A
08/01/2026 04:16,SENSOR-034,64.82,4.796,NORMAL,línea B
2026-01-17 19:31:48,SENSOR-044,62.1,3.337,ok,línea A
2026-01-06 09:14:59,SENSOR-050,36.03,4.547,ok,línea A
11/01/2026 14:53,SENSOR-045,63.9,3.895,OK,línea C
2026-01-15 13:43:12,SENSOR-049,39.16,41.805,NORMAL,B
2026-01-05 21:02:57,SENSOR-039,44.46,1.45,ok,Linea C
19/01/2026 03:19,SENSOR-007,"40,52",1.49,ok,Linea C
2026-01-13T10:58:31,SENSOR-008,37.43,3.652,ok,b
25/01/2026 13:40,SENSOR-012,34.47,10.504,NORMAL,C
2026-01-06T16:01:25,SENSOR-030,66.22,5.224,OK,B
2026-01-08T02:08:22,SENSOR-018,32.39,0.507,OK,línea A
2026-01-27 01:23:13,SENSOR-019,55.56,2.864,NORMAL,B
03/01/2026 21:38,SENSOR-014,49.43,2.324,OK,A
2025-12-30 00:33:42,SENSOR-003,45.48,1.178,0,línea A
2026-01-18T05:32:20,SENSOR-044,35.61,2.006,2,Linea C
2026-01-20 10:53:02,SENSOR-047,45.72,3.771,Alerta,B
2026-01-12T18:06:47,SENSOR-049,25.82,16.163,ok,B
2025-12-30 16:34:44,SENSOR-021,"29,1",3.293,0,línea B
2026-01-28T08:56:53,SENSOR-016,168.49,2.909,WARN,c
2026-01-02T15:48:32,SENSOR-011,44.24,0.836,NORMAL,B
2026-01-24 13:01:41,SENSOR-029,28.57,0.152,0,C
25/01/2026 03:42,SENSOR-035,71.31,1.239,0,A
2026-01-05 01:26:31,SENSOR-035,73.32,2.575,WARN,línea A
2026-01-24 08:17:39,SENSOR-046,77.15,2.533,ok,línea A
2026-01-12 08:02:39,SENSOR-019,39.42,30.281,NORMAL,línea A
2026-01-25 09:24:27,SENSOR-022,52.41,4.496,warning,B
2026-01-25 00:58:30,SENSOR-016,36.87,1.375,ok,C
2026-01-21 16:02:08,SENSOR-020,52.84,34.774,ok,línea A
07/01/2026 01:44,SENSOR-041,65.47,3.636,0,Linea A
2026-01-15 19:51:01,SENSOR-044,43.77,16.843,ok,C
2026-01-27T20:38:14,SENSOR-035,101.53,1.651,OK,b
2026-01-08T01:01:25,SENSOR-040,30.55,2.221,WARN,línea B
10/01/2026 00:32,SENSOR-046,87.34,1.589,Alerta,a
2026-01-19T01:09:38,SENSOR-035,44.51,48.197,OK,Linea B
2026-01-18T11:26:24,SENSOR-017,71.45,4.64,OK,c
2025-12-31 07:12:21,SENSOR-039,82.12,3.865,2,línea B
2026-01-06T00:08:44,SENSOR-033,16.51,4.659,NORMAL,línea B
2026-01-03T11:14:58,SENSOR-007,73.28,1.263,NORMAL,línea C
2026-01-10T21:34:08,SENSOR-030,63.44,2.289,NORMAL,línea C
2026-01-11T03:55:29,SENSOR-021,70.31,3.959,NORMAL,Linea C
2026-01-16T15:39:25,SENSOR-019,55.42,3.63,NORMAL,b
2026-01-13 07:30:40,SENSOR-025,38.61,2.648,OK,C
2026-01-03T08:46:32,SENSOR-018,"122,5",46.147,NORMAL,Linea C
2025-12-30 19:52:31,SENSOR-009,29.79,0.274,0,A
2026-01-14T04:24:39,SENSOR-049,65.98,4.482,1,línea A
2026-01-21T08:35:06,SENSOR-027,34.78,3.555,0,C
2026-01-26T05:10:18,SENSOR-014,27.45,4.462,NORMAL,b
23/01/2026 14:39,SENSOR-045,35.96,3.266,OK,Linea B
07/01/2026 11:55,SENSOR-045,55.71,2.829,NORMAL,Linea B
24/01/2026 08:59,SENSOR-017,39.23,0.177,OK,C
2026-01-12T10:40:48,SENSOR-038,154.85,2.698,NORMAL,Linea B
2026-01-06 21:56:12,SENSOR-045,30.67,4.097,0,línea B
2026-01-27T20:32:28,SENSOR-028,51.27,7.884,0,línea A
2026-01-01T04:44:45,SENSOR-007,76.78,2.459,NORMAL,línea B
11/01/2026 17:07,SENSOR-046,75.96,18.071,ok,a
2026-01-14T18:18:49,SENSOR-044,60.11,0.0,OK,B
2026-01-06T19:31:13,SENSOR-036,41.95,1.52,ok,b
04/01/2026 06:40,SENSOR-031,62.64,0.699,OK,C
2026-01-26 15:50:58,SENSOR-019,29.29,1.909,ok,B
2025-12-31 11:17:22,SENSOR-001,43.49,30.699,0,línea B
26/01/2026 14:14,SENSOR-044,,3.17,OK,C
10/01/2026 15:07,SENSOR-036,"190,89",4.04,NORMAL,línea A
2026-01-22 03:50:04,SENSOR-039,198.77,4.673,OK,línea B
01/01/2026 18:21,SENSOR-038,49.51,0.0,0,A
2026-01-15T12:57:49,SENSOR-041,28.71,4.198,1,b
21/01/2026 06:22,SENSOR-038,50.71,1.139,0,línea C
2026-01-11T11:51:12,SENSOR-019,"54,52",0.371,FAIL,a
09/01/2026 02:55,SENSOR-021,68.92,2.037,0,a
13/01/2026 04:58,SENSOR-012,48.33,4.103,warning,C
2026-01-18 11:42:01,SENSOR-045,70.97,3.297,OK,A
2026-01-04 06:09:10,SENSOR-033,"48,7",2.665,warning,línea A
2026-01-04 18:29:55,SENSOR-005,78.34,1.112,0,Linea B
2026-01-05 15:55:09,SENSOR-013,70.62,2.913,warning,c
2025-12-30T13:01:56,SENSOR-020,71.65,2.027,ok,Linea A
2026-01-25T17:27:32,SENSOR-019,,10.096,0,A
2025-12-31 15:27:06,SENSOR-007,72.36,4.925,0,a
2026-01-26T05:19:52,SENSOR-048,28.95,2.733,OK,b
2025-12-29T18:31:48,SENSOR-002,25.19,0.733,FAIL,A
2026-01-18 02:32:55,SENSOR-037,36.89,2.072,0,a
14/01/2026 20:13,SENSOR-044,,3.207,ok,c
30/12/2025 15:50,SENSOR-044,60.38,1.194,NORMAL,A
26/01/2026 15:50,SENSOR-022,58.76,0.868,0,línea B
2026-01-20T07:56:43,SENSOR-038,79.34,11.689,ok,Linea B
24/01/2026 18:56,SENSOR-016,29.17,33.676,NORMAL,a
2026-01-11T11:33:10,SENSOR-007,63.17,8.219,NORMAL,línea A
07/01/2026 03:37,SENSOR-033,23.32,0.202,fail,A
2026-01-04T00:27:35,SENSOR-026,60.89,1.777,0,b
2026-01-01T19:05:58,SENSOR-050,66.38,0.197,ERROR,línea C
2026-01-02T11:42:22,SENSOR-011,46.41,2.635,WARN,B
2026-01-18 13:00:32,SENSOR-026,36.56,3.203,0,Linea A
2026-01-23T02:13:07,SENSOR-012,59.29,3.344,Alerta,línea B
04/01/2026 19:16,SENSOR-022,"34,38",4.493,ok,Linea C
30/12/2025 04:58,SENSOR-050,36.91,4.489,NORMAL,Linea B
09/01/2026 06:37,SENSOR-047,"30,16",0.847,WARN,C
03/01/2026 00:35,SENSOR-014,40.87,3.562,NORMAL,Linea B
05/01/2026 04:21,SENSOR-015,51.51,0.677,OK,Linea B
05/01/2026 02:24,SENSOR-015,59.39,0.122,ok,línea B
18/01/2026 07:08,SENSOR-013,50.05,4.287,0,b
11/01/2026 10:59,SENSOR-045,21.92,4.675,NORMAL,c
2026-01-15T06:09:28,SENSOR-044,58.81,1.105,ok,C
2026-01-10T03:15:15,SENSOR-046,-3.15,0.285,OK,A
2026-01-27 22:38:04,SENSOR-038,69.72,3.663,NORMAL,a
13/01/2026 08:19,SENSOR-030,37.47,1.915,0,B
2025-12-30 17:02:35,SENSOR-030,"35,44",0.911,0,A
2026-01-06T16:01:25,SENSOR-030,66.22,5.224,OK,B
02/01/2026 14:48,SENSOR-008,76.27,0.818,1,Linea A
20/01/2026 08:59,SENSOR-010,71.46,42.782,OK,línea A
2026-01-25 19:04:00,SENSOR-046,45.88,0.0,0,línea C
2026-01-02 05:16:47,SENSOR-034,36.21,42.372,NORMAL,Linea C
2026-01-12 05:32:00,SENSOR-009,54.83,3.027,warning,Linea C
2026-01-24T06:28:25,SENSOR-001,47.11,28.088,OK,C
14/01/2026 23:58,SENSOR-030,43.12,2.489,WARN,Linea B
2025-12-29T22:51:09,SENSOR-037,40.45,4.522,ERROR,c
2026-01-14T00:55:10,SENSOR-024,28.64,4.66,WARN,línea A
2026-01-07 01:59:47,SENSOR-046,49.56,1.782,NORMAL,línea C
04/01/2026 19:49,SENSOR-010,67.03,4.192,OK,b
2026-01-26T12:22:22,SENSOR-014,"40,26",1.732,OK,a
01/01/2026 14:39,SENSOR-016,80.25,2.415,NORMAL,Linea A
23/01/2026 07:23,SENSOR-038,60.67,4.074,FAIL,c
2026-01-21T00:47:31,SENSOR-025,37.78,0.629,OK,línea B
2026-01-16T04:40:27,SENSOR-021,,3.019,OK,Linea B
2026-01-08 04:27:38,SENSOR-012,,4.846,2,B
2025-12-31 21:27:11,SENSOR-049,70.15,4.6,WARN,C
2026-01-18 11:29:17,SENSOR-031,"58,06",3.025,0,línea B
27/01/2026 05:14,SENSOR-036,68.15,0.896,NORMAL,Linea A
2026-01-03 19:17:42,SENSOR-004,57.85,2.73,0,B
2026-01-02 05:15:02,SENSOR-040,33.87,4.45,fail,b
2026-01-12T16:07:35,SENSOR-005,38.3,2.385,ok,a
2026-01-23T23:23:07,SENSOR-047,57.27,1.137,NORMAL,A
2025-12-29T13:38:07,SENSOR-011,58.45,2.856,1,línea B
2026-01-22T02:28:06,SENSOR-018,"59,43",4.102,ok,B
2026-01-01 00:42:56,SENSOR-045,68.0,1.53,OK,A
2025-12-30T09:06:28,SENSOR-005,"36,27",0.809,0,línea B
02/01/2026 19:43,SENSOR-031,53.26,4.872,NORMAL,línea C
12/01/2026 04:03,SENSOR-045,35.31,3.006,fail,c
26/01/2026 12:26,SENSOR-049,62.16,0.0,NORMAL,C
2026-01-18 05:54:54,SENSOR-012,42.15,4.279,ok,c
2025-12-31 05:14:19,SENSOR-049,34.62,0.798,0,A
02/01/2026 23:53,SENSOR-039,"58,05",2.715,0,A
2026-01-12T06:15:09,SENSOR-046,51.83,0.152,OK,Linea A
2026-01-01T03:35:54,SENSOR-015,52.88,2.495,0,Linea A
2026-01-18T11:14:12,SENSOR-008,57.33,2.429,NORMAL,Linea C
09/01/2026 04:40,SENSOR-031,75.74,2.499,ok,a
2026-01-27 02:15:01,SENSOR-050,27.3,4.562,0,Linea C
2026-01-23T00:50:33,SENSOR-009,"53,33",4.029,OK,Linea A
2026-01-22 21:58:53,SENSOR-002,61.89,1.43,OK,Linea B
05/01/2026 11:54,SENSOR-020,63.34,0.0,1,A
2026-01-11T08:57:41,SENSOR-028,"44,69",11.207,0,línea A
2026-01-18 14:14:00,SENSOR-022,63.71,1.914,ok,línea C
2026-01-01T02:44:42,SENSOR-006,"77,69",3.798,ok,B
29/12/2025 16:37,SENSOR-036,29.42,16.233,OK,C
2026-01-08T06:00:23,SENSOR-020,66.74,3.567,0,línea A
2026-01-10 10:26:14,SENSOR-025,38.79,30.956,0,c
22/01/2026 00:57,SENSOR-020,31.49,4.031,warning,línea C
2026-01-22T20:45:28,SENSOR-041,61.65,0.201,0,Linea C
31/12/2025 04:23,SENSOR-021,32.8,0.663,ok,línea C
2025-12-31 08:31:20,SENSOR-004,33.49,3.744,0,a
26/01/2026 04:23,SENSOR-023,31.54,3.154,NORMAL,Linea A
07/01/2026 01:52,SENSOR-048,"26,4",0.114,ok,Linea C
02/01/2026 04:43,SENSOR-037,37.84,1.456,ok,Linea C
2026-01-22 04:54:50,SENSOR-037,5.74,2.5,OK,línea A
2026-01-21T23:16:58,SENSOR-045,87.46,48.252,WARN,C
2026-01-16T13:10:15,SENSOR-029,,3.163,OK,línea A
2026-01-21 10:45:04,SENSOR-025,72.97,1.43,OK,B
2026-01-24 05:05:07,SENSOR-012,,30.338,OK,B
2026-01-24T00:06:57,SENSOR-012,69.24,3.308,0,C
2026-01-06 07:27:26,SENSOR-001,"51,14",3.922,0,Linea A
11/01/2026 01:06,SENSOR-040,66.84,4.45,warning,c
2026-01-27 23:09:31,SENSOR-014,67.5,4.512,2,A
2026-01-09T10:43:04,SENSOR-017,"54,53",0.798,ok,línea C
2026-01-17 04:36:31,SENSOR-044,56.41,1.065,WARN,línea C
2026-01-23T19:56:26,SENSOR-049,73.76,2.925,0,Linea C
24/01/2026 17:50,SENSOR-022,30.83,34.11,fail,B
2026-01-16 11:38:08,SENSOR-049,"61,31",2.02,ok,Linea A
2026-01-08 22:22:14,SENSOR-019,66.17,3.578,0,Linea A
2026-01-27 22:38:04,SENSOR-038,69.72,3.663,NORMAL,a
2026-01-19 03:27:31,SENSOR-024,30.49,4.252,NORMAL,A
29/12/2025 12:34,SENSOR-035,57.8,0.673,0,línea B
2026-01-08T23:00:56,SENSOR-041,44.78,3.402,1,b
2026-01-21 04:38:54,SENSOR-045,79.1,2.471,OK,línea B
17/01/2026 20:07,SENSOR-002,64.05,3.088,ok,línea A
2025-12-31 19:31:32,SENSOR-001,"22,15",3.181,NORMAL,Linea B
20/01/2026 00:20,SENSOR-025,"46,36",21.438,ok,Linea C
16/01/2026 17:09,SENSOR-001,47.05,2.406,ERROR,línea B
2026-01-11T18:06:20,SENSOR-019,56.12,1.081,NORMAL,c
01/01/2026 13:56,SENSOR-028,42.47,4.761,2,c
2026-01-16T08:00:57,SENSOR-038,68.76,2.531,NORMAL,línea C
2026-01-20 19:07:24,SENSOR-049,65.59,0.283,WARN,línea B
04/01/2026 09:16,SENSOR-038,26.53,2.135,warning,c
17/01/2026 11:32,SENSOR-049,"38,54",2.722,WARN,línea A
31/12/2025 13:27,SENSOR-020,65.29,4.835,OK,Linea A
2026-01-04T13:40:18,SENSOR-036,36.48,1.208,NORMAL,B
2026-01-09 04:20:39,SENSOR-036,,4.058,0,Linea A
2026-01-21 18:48:00,SENSOR-045,79.98,3.506,1,b
2026-01-06T21:58:03,SENSOR-016,175.44,3.642,OK,b
2026-01-25 03:10:10,SENSOR-003,27.65,2.744,OK,b
2026-01-27 22:23:20,SENSOR-007,63.43,4.367,ok,línea B
2026-01-03T08:08:28,SENSOR-009,63.93,2.472,WARN,a
2025-12-30T05:16:35,SENSOR-013,27.45,1.685,OK,c
2026-01-20 07:14:15,SENSOR-042,34.94,0.243,WARN,línea B
21/01/2026 08:58,SENSOR-046,"71,84",0.765,OK,línea B
19/01/2026 07:26,SENSOR-005,34.38,0.745,NORMAL,a
2026-01-25T10:23:21,SENSOR-006,38.66,4.391,OK,c
18/01/2026 14:22,SENSOR-008,75.16,1.555,0,A
2026-01-21 19:40:49,SENSOR-041,68.79,14.355,ok,Linea A
09/01/2026 09:01,SENSOR-030,36.39,3.789,0,C
2026-01-01 10:32:39,SENSOR-003,63.64,37.46,1,línea A
28/01/2026 10:12,SENSOR-049,25.39,1.956,0,Linea B
2026-01-16T13:22:15,SENSOR-001,68.16,3.97,ok,c
2026-01-06 12:36:58,SENSOR-024,69.79,0.688,ok,línea A
2026-01-25 05:18:52,SENSOR-019,37.43,2.392,ok,b
31/12/2025 14:58,SENSOR-030,68.67,0.623,ok,Linea C
2025-12-31T03:27:27,SENSOR-009,51.54,2.646,NORMAL,a
06/01/2026 01:12,SENSOR-016,"28,54",23.845,OK,A
02/01/2026 07:58,SENSOR-028,48.83,4.087,ok,línea B
2026-01-10 17:54:48,SENSOR-048,36.73,2.408,OK,línea B
17/01/2026 01:12,SENSOR-010,75.84,4.381,NORMAL,Linea B
2026-01-14T00:12:26,SENSOR-043,51.88,3.049,0,Linea A
2026-01-15T00:50:04,SENSOR-037,79.32,0.515,0,Linea A
02/01/2026 00:01,SENSOR-033,31.62,3.042,ok,c
2026-01-14 10:59:41,SENSOR-047,36.43,0.526,ERROR,Linea A
27/01/2026 15:56,SENSOR-015,73.35,4.729,OK,a
2026-01-08 08:05:24,SENSOR-045,56.81,4.904,warning,Linea A
2026-01-22T10:04:00,SENSOR-022,57.3,0.328,ok,B
2026-01-17 13:38:30,SENSOR-032,"69,83",0.527,0,A
21/01/2026 06:58,SENSOR-005,"75,4",3.116,ok,C
2026-01-18T03:39:50,SENSOR-050,78.17,2.411,0,Linea A
2026-01-11 14:20:15,SENSOR-049,73.75,3.499,0,a
2026-01-05 11:52:31,SENSOR-048,64.59,1.918,ok,B
2026-01-01T05:56:41,SENSOR-011,59.36,1.405,ok,línea A
2026-01-01T19:36:42,SENSOR-029,125.54,3.174,NORMAL,Linea B
01/01/2026 10:57,SENSOR-045,31.04,1.228,NORMAL,a
2026-01-21T10:49:02,SENSOR-014,52.57,4.876,OK,A
2026-01-23T13:20:27,SENSOR-013,56.64,2.079,1,A
2026-01-22 22:43:33,SENSOR-022,37.09,4.877,0,Linea A
2026-01-24 23:28:45,SENSOR-003,,0.415,0,línea A
2026-01-09 04:13:18,SENSOR-039,71.95,2.556,Alerta,C
2026-01-18T15:37:07,SENSOR-015,"45,9",1.873,NORMAL,línea A
2026-01-23 00:48:36,SENSOR-016,"40,61",3.805,NORMAL,B
02/01/2026 09:23,SENSOR-004,62.37,3.039,ok,línea C
2025-12-29T10:08:34,SENSOR-037,72.64,4.048,ok,Linea B
2026-01-04T17:16:38,SENSOR-041,"78,34",1.576,ok,línea C
2026-01-25T21:52:30,SENSOR-042,69.39,3.395,0,línea C
2026-01-22T16:09:58,SENSOR-048,,0.468,OK,a
02/01/2026 07:37,SENSOR-020,"52,21",2.042,NORMAL,línea A
2026-01-23 20:39:26,SENSOR-004,65.65,2.005,OK,C
2026-01-03 16:06:28,SENSOR-003,52.31,4.334,OK,A
2026-01-06T10:29:10,SENSOR-046,120.25,2.49,OK,Linea B
2026-01-03 11:26:30,SENSOR-003,178.4,4.852,OK,Linea A
2026-01-24T22:27:42,SENSOR-030,30.66,42.872,2,Linea B
2026-01-23 05:55:02,SENSOR-016,189.13,0.514,0,Linea B
2025-12-31T08:38:59,SENSOR-013,48.93,2.978,0,línea B
2025-12-30 03:37:51,SENSOR-030,46.1,0.0,ok,Linea C
22/01/2026 03:51,SENSOR-025,67.96,11.697,NORMAL,c
2026-01-10 06:04:52,SENSOR-037,64.26,0.826,NORMAL,C
2026-01-15T10:58:22,SENSOR-034,30.15,2.651,0,Linea B
2026-01-17 13:54:51,SENSOR-011,28.9,3.478,0,Linea A
14/01/2026 17:47,SENSOR-036,30.69,3.452,0,línea C
2026-01-04 01:24:55,SENSOR-045,57.32,0.5,0,línea B
2026-01-07T17:41:52,SENSOR-015,29.32,3.454,0,c
16/01/2026 08:05,SENSOR-023,55.9,0.424,ok,c
21/01/2026 22:58,SENSOR-043,78.63,0.561,NORMAL,C
2026-01-08T13:13:32,SENSOR-017,,14.089,OK,b
30/12/2025 02:20,SENSOR-041,"54,42",4.042,0,a
2026-01-02 18:40:01,SENSOR-024,31.45,2.808,fail,Linea B
06/01/2026 23:47,SENSOR-013,31.36,43.826,OK,A
2026-01-27T06:15:12,SENSOR-026,,4.995,0,línea B
2026-01-11 05:23:52,SENSOR-002,66.01,2.318,ok,C
13/01/2026 08:45,SENSOR-050,74.18,0.608,NORMAL,línea C
11/01/2026 02:27,SENSOR-009,75.03,3.704,ok,B
07/01/2026 01:44,SENSOR-041,65.47,3.636,0,Linea A
2026-01-24T09:55:05,SENSOR-006,55.98,3.391,OK,A
2026-01-10 10:26:14,SENSOR-025,38.79,30.956,0,c
22/01/2026 11:08,SENSOR-011,34.63,4.841,OK,a
2026-01-03T00:45:28,SENSOR-018,25.8,0.419,0,línea B
18/01/2026 10:03,SENSOR-041,28.67,1.45,OK,Linea B
2026-01-14 21:56:19,SENSOR-009,25.26,0.35,2,b
2026-01-25T08:24:07,SENSOR-021,69.26,1.197,0,línea B
31/12/2025 07:17,SENSOR-009,47.64,4.605,OK,C
15/01/2026 18:04,SENSOR-034,51.85,1.695,ok,Linea C
2026-01-04 03:00:43,SENSOR-011,,48.449,Alerta,B
2026-01-15T12:21:10,SENSOR-044,74.16,3.298,0,Linea A
2026-01-22T22:36:27,SENSOR-024,30.23,1.415,ok,A
2026-01-11T10:50:29,SENSOR-001,"36,49",3.202,ok,b
2026-01-14T11:32:49,SENSOR-047,30.55,3.264,ok,C
2026-01-09T08:55:01,SENSOR-034,79.57,4.995,WARN,Linea B
2026-01-26T18:14:22,SENSOR-015,,0.909,NORMAL,a
2026-01-24 07:17:37,SENSOR-019,36.12,4.259,ok,c
2026-01-01T02:41:09,SENSOR-014,195.86,4.529,0,línea C
2025-12-30T17:11:31,SENSOR-033,70.15,2.01,WARN,c
2026-01-14T11:48:37,SENSOR-006,40.92,4.634,0,C
2026-01-07 18:17:32,SENSOR-007,33.86,4.37,0,a
30/12/2025 08:30,SENSOR-001,30.11,3.727,ok,b
2026-01-10 10:26:14,SENSOR-025,38.79,30.956,0,c
2026-01-18 16:05:28,SENSOR-045,65.51,2.824,OK,Linea C
2026-01-03 03:02:43,SENSOR-024,59.83,3.335,ok,A
2026-01-17T17:18:42,SENSOR-041,"79,7",1.356,0,a
2026-01-01 09:32:32,SENSOR-006,,2.147,fail,línea B
2026-01-19 19:52:06,SENSOR-028,,1.699,2,b
2026-01-23T13:34:22,SENSOR-045,57.61,2.867,OK,a
22/01/2026 08:01,SENSOR-005,76.51,3.173,ok,línea C
2026-01-24 22:24:03,SENSOR-029,29.13,34.776,0,B
16/01/2026 20:45,SENSOR-038,75.47,0.902,0,línea B
08/01/2026 10:27,SENSOR-044,46.08,2.856,2,línea B
03/01/2026 21:54,SENSOR-020,70.26,29.625,ok,Linea C
18/01/2026 03:57,SENSOR-032,61.68,2.894,OK,B
2026-01-27T15:57:35,SENSOR-025,,1.837,NORMAL,Linea A
18/01/2026 04:11,SENSOR-040,78.39,3.338,OK,c
01/01/2026 13:00,SENSOR-046,"93,13",1.714,0,línea A
2025-12-30T17:55:56,SENSOR-009,53.03,0.772,ok,Linea A
2026-01-23 05:55:02,SENSOR-016,189.13,0.514,0,Linea B
2026-01-02 23:24:08,SENSOR-027,,1.181,ok,línea A
22/01/2026 12:19,SENSOR-042,59.03,0.625,ok,Linea C
02/01/2026 12:22,SENSOR-034,51.52,2.154,NORMAL,c
2026-01-19 14:40:28,SENSOR-002,25.35,2.748,OK,A
2026-01-15 22:52:37,SENSOR-014,46.61,4.937,NORMAL,b
09/01/2026 08:54,SENSOR-044,52.09,4.471,OK,c
2026-01-11T00:50:08,SENSOR-049,40.48,1.536,0,línea C
2026-01-06 08:02:29,SENSOR-035,41.66,4.911,OK,a
2026-01-10T18:32:36,SENSOR-036,52.54,0.163,ok,C
03/01/2026 22:59,SENSOR-037,43.14,3.115,NORMAL,Linea A
2026-01-14T07:22:21,SENSOR-032,42.81,3.766,OK,b
2026-01-18 06:12:50,SENSOR-033,48.13,0.247,WARN,Linea A
14/01/2026 22:16,SENSOR-005,59.14,0.0,NORMAL,c
2026-01-28T03:43:51,SENSOR-050,63.65,1.739,0,B
2026-01-26 04:40:11,SENSOR-044,46.79,3.384,NORMAL,B
2026-01-25 03:36:39,SENSOR-035,38.61,3.365,0,b
16/01/2026 13:17,SENSOR-041,26.14,2.646,OK,Linea C
2026-01-02 17:38:26,SENSOR-008,"71,59",1.99,NORMAL,línea C
2026-01-21T04:30:38,SENSOR-012,45.22,46.172,warning,línea C
2026-01-26T17:51:17,SENSOR-036,60.74,2.169,warning,C
16/01/2026 10:21,SENSOR-027,42.74,3.552,ok,a
2026-01-12 01:07:19,SENSOR-042,61.37,3.883,OK,línea A
18/01/2026 01:34,SENSOR-015,16.11,1.315,NORMAL,A
2026-01-11T11:33:10,SENSOR-007,63.17,8.219,NORMAL,línea A
17/01/2026 05:45,SENSOR-028,61.96,0.727,OK,A
23/01/2026 06:03,SENSOR-013,42.81,0.349,OK,a
2026-01-12 19:34:37,SENSOR-013,42.64,4.476,OK,B
2026-01-09T13:54:23,SENSOR-042,"78,66",1.39,ok,línea C
2026-01-22T15:32:11,SENSOR-007,51.76,0.364,0,Linea B
2026-01-12T09:07:45,SENSOR-020,69.39,2.924,2,b
17/01/2026 20:41,SENSOR-021,53.2,6.482,FAIL,Linea A
06/01/2026 22:52,SENSOR-045,38.07,2.313,NORMAL,línea B
14/01/2026 14:09,SENSOR-017,66.86,0.132,ERROR,c
2026-01-15 07:29:02,SENSOR-043,59.75,3.604,ok,Linea A
16/01/2026 00:19,SENSOR-032,31.2,2.687,FAIL,c
2026-01-21T23:41:53,SENSOR-015,72.67,2.812,NORMAL,Linea B
08/01/2026 14:27,SENSOR-039,54.29,2.902,WARN,línea B
2026-01-03T12:14:12,SENSOR-024,44.0,0.319,WARN,C
2026-01-09T16:30:56,SENSOR-044,73.22,3.678,WARN,A
2026-01-15T23:55:35,SENSOR-004,54.44,4.395,warning,línea B
13/01/2026 03:08,SENSOR-030,"55,44",2.678,ok,Linea A
2026-01-09T14:21:25,SENSOR-040,5.38,2.347,1,línea A
11/01/2026 01:44,SENSOR-011,60.06,2.664,0,línea A
2026-01-03T18:06:39,SENSOR-024,35.08,4.106,0,línea A
2026-01-01T14:01:28,SENSOR-020,64.45,3.984,0,línea A
2026-01-26T05:19:52,SENSOR-048,28.95,2.733,OK,b
2026-01-18T03:05:13,SENSOR-018,32.95,2.521,0,b
2025-12-31 14:25:05,SENSOR-021,63.4,2.657,1,línea B
15/01/2026 15:26,SENSOR-043,"53,88",2.339,NORMAL,línea C
2026-01-27 16:21:31,SENSOR-040,78.1,1.559,NORMAL,Linea A
2026-01-13T14:40:27,SENSOR-043,56.78,0.0,ok,línea B
2026-01-19T19:14:08,SENSOR-014,,3.939,0,A
21/01/2026 07:58,SENSOR-041,64.95,0.743,0,Linea B
13/01/2026 01:14,SENSOR-016,77.74,1.942,OK,Linea B
2026-01-14T04:28:00,SENSOR-019,31.7,1.973,NORMAL,a
2026-01-05T08:52:13,SENSOR-046,75.52,1.23,NORMAL,b
17/01/2026 05:23,SENSOR-004,"55,33",0.448,OK,a
2026-01-14 04:29:51,SENSOR-003,44.99,0.902,0,línea C
08/01/2026 11:33,SENSOR-034,50.5,3.356,ok,línea B
2026-01-26 12:57:29,SENSOR-006,70.82,2.684,NORMAL,c
2026-01-17 09:17:54,SENSOR-006,166.39,0.816,ok,a
2026-01-10T21:52:52,SENSOR-028,163.12,0.249,Alerta,Linea B
2026-01-25 12:17:28,SENSOR-022,177.11,3.055,0,a
01/01/2026 10:57,SENSOR-045,31.04,1.228,NORMAL,a
21/01/2026 07:55,SENSOR-011,138.26,0.679,NORMAL,b
2026-01-27 13:06:13,SENSOR-012,55.54,0.709,NORMAL,a
08/01/2026 13:44,SENSOR-035,53.75,16.651,OK,B
2026-01-12 20:48:53,SENSOR-018,47.19,4.591,FAIL,línea A
2026-01-05T11:08:31,SENSOR-025,58.36,4.387,NORMAL,Linea B
2026-01-20 07:08:29,SENSOR-022,67.39,1.525,0,b
2026-01-23 15:29:47,SENSOR-042,"46,14",4.062,warning,C
19/01/2026 03:29,SENSOR-022,60.51,3.717,FAIL,línea C
19/01/2026 18:28,SENSOR-007,59.7,4.835,ok,A
2026-01-02 18:06:51,SENSOR-009,60.96,3.687,ok,Linea B
2026-01-26T10:02:50,SENSOR-040,56.1,4.283,OK,línea C
02/01/2026 15:16,SENSOR-001,36.23,0.442,OK,A
22/01/2026 14:57,SENSOR-050,38.25,1.775,WARN,Linea C
2026-01-03 10:17:18,SENSOR-003,121.53,4.308,0,B
19/01/2026 00:14,SENSOR-035,30.62,0.904,0,línea A
20/01/2026 18:33,SENSOR-043,76.9,4.903,NORMAL,línea C
2026-01-03 18:46:52,SENSOR-029,"63,37",3.597,ok,Linea A
2026-01-15T03:55:08,SENSOR-020,75.75,2.421,ok,C
05/01/2026 21:30,SENSOR-005,"119,83",45.676,ok,línea A
2026-01-26 23:54:03,SENSOR-038,33.14,4.454,0,Linea A
2026-01-03 21:48:52,SENSOR-004,51.94,2.648,NORMAL,c
2026-01-27T22:03:14,SENSOR-010,61.07,47.96,Alerta,Linea C
2026-01-13 10:02:16,SENSOR-031,,0.275,ok,Linea B
29/12/2025 14:26,SENSOR-047,33.75,2.366,0,c
2026-01-03 02:33:37,SENSOR-013,26.29,3.92,WARN,Linea B
2026-01-08 22:46:22,SENSOR-027,59.55,4.698,Alerta,Linea A
18/01/2026 16:58,SENSOR-018,176.87,2.931,OK,C
2026-01-17 14:16:58,SENSOR-025,64.77,4.284,0,línea A
2026-01-05 04:12:01,SENSOR-042,80.6,1.43,NORMAL,A
2026-01-11 05:54:36,SENSOR-029,,1.023,OK,A
23/01/2026 21:11,SENSOR-035,97.15,0.0,OK,línea A
2026-01-12T13:54:23,SENSOR-041,,0.448,ok,línea C
07/01/2026 23:25,SENSOR-016,27.24,1.098,ok,línea C
2026-01-17 13:02:27,SENSOR-027,59.06,3.396,NORMAL,Linea B
2026-01-24 08:23:27,SENSOR-033,32.69,3.283,OK,línea B
2026-01-19T08:29:09,SENSOR-032,30.61,3.405,1,Linea A
27/01/2026 19:36,SENSOR-024,134.55,1.102,NORMAL,B
11/01/2026 17:40,SENSOR-040,55.15,2.463,0,línea B
2025-12-29T21:00:31,SENSOR-019,40.18,1.353,warning,B
2025-12-30T13:57:22,SENSOR-044,25.48,2.182,WARN,Linea C
2026-01-27T14:21:07,SENSOR-002,79.27,2.569,1,A
2026-01-09T08:51:27,SENSOR-030,27.5,37.823,ok,A
2026-01-21 18:30:34,SENSOR-030,49.48,1.686,WARN,C
2026-01-27T12:39:32,SENSOR-028,72.47,23.746,0,C
2026-01-14T21:24:43,SENSOR-027,31.75,4.098,ok,Linea C
18/01/2026 15:09,SENSOR-040,61.85,1.565,2,C
15/01/2026 06:54,SENSOR-029,63.91,1.795,OK,línea B
2026-01-20 07:54:30,SENSOR-011,50.06,4.687,OK,línea C
23/01/2026 01:55,SENSOR-007,71.12,1.12,OK,c
19/01/2026 07:00,SENSOR-012,48.79,0.0,0,B
2026-01-18 09:16:17,SENSOR-002,70.26,0.871,0,línea A
30/12/2025 10:09,SENSOR-013,72.98,0.262,OK,A
02/01/2026 05:37,SENSOR-043,44.98,0.385,OK,Linea C
2025-12-31 11:17:22,SENSOR-001,43.49,30.699,0,línea B
11/01/2026 21:01,SENSOR-043,40.14,0.0,2,C
2026-01-22T21:11:29,SENSOR-003,42.05,0.0,NORMAL,Linea A
23/01/2026 12:36,SENSOR-040,39.64,1.396,1,b
2026-01-11T06:43:37,SENSOR-007,"66,88",4.231,NORMAL,b
2026-01-23T13:24:57,SENSOR-008,48.8,0.205,0,b
08/01/2026 20:42,SENSOR-046,31.06,33.462,OK,C
17/01/2026 21:40,SENSOR-016,74.06,1.676,OK,Linea B
2026-01-02T04:23:00,SENSOR-039,39.28,4.531,NORMAL,Linea B
2026-01-27 01:01:10,SENSOR-012,48.26,0.423,NORMAL,línea A
2026-01-09 02:38:36,SENSOR-049,78.12,0.876,0,B
2026-01-07T18:19:21,SENSOR-040,43.46,3.084,WARN,c
2025-12-31 14:04:01,SENSOR-046,"35,82",0.0,0,b
2026-01-04T14:27:14,SENSOR-017,37.9,4.583,OK,línea A
2025-12-30 19:56:56,SENSOR-033,36.76,0.0,NORMAL,línea C
2026-01-15T04:28:39,SENSOR-012,33.53,2.182,0,a
2026-01-27 17:50:08,SENSOR-012,45.84,1.541,0,línea A
29/12/2025 17:05,SENSOR-029,63.56,2.233,FAIL,línea C
13/01/2026 00:20,SENSOR-031,46.39,1.314,WARN,Linea A
2026-01-11 01:18:17,SENSOR-018,"76,13",2.141,OK,B
19/01/2026 13:31,SENSOR-011,58.26,3.183,WARN,A
31/12/2025 08:12,SENSOR-003,76.83,3.807,OK,Linea C
2026-01-04T02:11:56,SENSOR-050,43.45,0.773,0,A
2026-01-08 21:35:12,SENSOR-036,171.45,2.793,OK,Linea C
2026-01-08T06:40:11,SENSOR-044,77.17,3.517,NORMAL,línea B
2026-01-10 21:07:32,SENSOR-023,"40,77",2.939,0,línea A
13/01/2026 01:54,SENSOR-009,73.48,0.672,FAIL,Linea C
10/01/2026 07:00,SENSOR-023,51.4,1.22,ok,Linea A
2026-01-09 04:31:32,SENSOR-022,34.54,4.83,ok,b
2026-01-26 13:28:06,SENSOR-041,43.22,2.052,0,B
2026-01-01T12:23:02,SENSOR-031,7.9,2.375,OK,Linea C
06/01/2026 03:07,SENSOR-001,78.91,3.505,NORMAL,A
2026-01-19T04:25:53,SENSOR-020,76.19,4.573,OK,A
09/01/2026 11:10,SENSOR-024,51.46,2.378,OK,C
2026-01-04 02:55:26,SENSOR-013,46.93,11.029,NORMAL,c
24/01/2026 09:40,SENSOR-032,89.05,3.029,ok,Linea A
11/01/2026 02:36,SENSOR-001,,3.883,NORMAL,Linea B
17/01/2026 18:19,SENSOR-025,78.81,0.419,OK,c
2026-01-26 01:41:28,SENSOR-024,64.28,1.469,ok,A
16/01/2026 13:17,SENSOR-041,26.14,2.646,OK,Linea C
2026-01-09 00:04:10,SENSOR-011,57.33,0.0,ok,línea A
2026-01-26 06:47:18,SENSOR-002,48.77,4.085,0,línea B
2026-01-11 12:19:00,SENSOR-047,64.87,4.576,ok,b
2026-01-11T20:23:13,SENSOR-032,63.08,2.022,NORMAL,C
30/12/2025 15:03,SENSOR-009,56.47,1.733,Alerta,c
2025-12-30 23:03:24,SENSOR-049,,2.931,0,A
26/01/2026 12:11,SENSOR-026,63.72,1.307,NORMAL,b
2026-01-26T19:21:36,SENSOR-002,50.1,3.567,0,b
2026-01-10T05:20:55,SENSOR-022,73.88,3.49,WARN,B
2026-01-11T03:55:29,SENSOR-021,70.31,3.959,NORMAL,Linea C
2026-01-23 10:20:04,SENSOR-021,"59,07",3.393,NORMAL,línea A
2026-01-20T09:26:12,SENSOR-008,61.58,1.127,ok,b
09/01/2026 11:16,SENSOR-005,,0.852,OK,b
31/12/2025 07:12,SENSOR-022,38.69,4.286,OK,Linea B
2026-01-16 14:20:21,SENSOR-047,44.02,0.833,NORMAL,C
2026-01-02 00:58:44,SENSOR-036,57.55,2.38,ok,A
2026-01-11T18:27:17,SENSOR-044,"77,19",1.627,1,línea B
2026-01-13T09:54:17,SENSOR-010,38.06,0.396,0,A
2025-12-30 10:18:48,SENSOR-031,51.98,3.205,0,A
04/01/2026 13:22,SENSOR-050,48.23,40.99,0,a
2026-01-07T01:07:03,SENSOR-017,176.13,4.251,0,Linea C
19/01/2026 12:40,SENSOR-001,52.53,4.681,0,c
2026-01-02 23:30:14,SENSOR-002,72.08,2.483,0,B
2026-01-16 13:51:11,SENSOR-015,146.14,1.3,ok,b
09/01/2026 06:02,SENSOR-009,159.57,2.233,ok,línea A
2026-01-14T10:53:17,SENSOR-021,51.28,3.144,OK,a
2026-01-24T09:01:21,SENSOR-016,53.51,1.799,OK,B
16/01/2026 21:32,SENSOR-011,25.08,4.853,OK,C
23/01/2026 13:22,SENSOR-029,59.19,2.215,ok,a
2026-01-04 15:37:40,SENSOR-025,51.65,4.49,NORMAL,línea A
2026-01-05 15:06:44,SENSOR-024,27.26,4.485,Alerta,a
2026-01-12T17:01:56,SENSOR-033,68.17,46.416,0,B
2026-01-05 02:01:14,SENSOR-009,52.8,0.594,Alerta,c
2026-01-07 18:48:37,SENSOR-034,56.98,3.017,OK,Linea C
21/01/2026 17:28,SENSOR-001,34.61,1.939,WARN,Linea B
2026-01-04T07:52:58,SENSOR-011,96.1,0.816,0,Linea B
2026-01-12 21:38:14,SENSOR-022,77.99,19.813,WARN,a
2026-01-08T08:00:53,SENSOR-042,74.36,1.765,NORMAL,C
2026-01-17 05:31:50,SENSOR-040,44.25,33.459,Alerta,línea B
12/01/2026 07:40,SENSOR-040,51.36,0.0,ok,b
25/01/2026 17:01,SENSOR-018,,2.47,NORMAL,línea A
14/01/2026 05:51,SENSOR-029,144.02,2.055,ok,Linea A
2026-01-11T12:40:10,SENSOR-003,64.02,0.963,NORMAL,línea B
25/01/2026 19:34,SENSOR-026,30.33,2.349,NORMAL,b
2025-12-31 19:38:20,SENSOR-044,64.1,16.424,Alerta,Linea B
10/01/2026 05:41,SENSOR-003,"64,54",3.476,2,Linea C
12/01/2026 09:30,SENSOR-041,37.45,4.03,0,B
2026-01-01T09:06:36,SENSOR-023,174.55,1.569,warning,Linea B
2026-01-24 13:26:15,SENSOR-013,72.83,1.857,ok,línea B
2026-01-23 17:58:14,SENSOR-035,58.01,3.77,ok,línea B
09/01/2026 22:01,SENSOR-040,47.99,0.181,ok,b
2026-01-15 08:20:43,SENSOR-049,55.21,2.107,OK,línea B
2026-01-14 08:03:27,SENSOR-011,36.24,1.75,OK,C
05/01/2026 09:43,SENSOR-006,52.38,3.754,warning,Linea C
31/12/2025 03:58,SENSOR-017,37.61,22.905,0,Linea C
2026-01-19 07:50:44,SENSOR-007,113.19,1.244,NORMAL,línea C
2026-01-22 02:44:05,SENSOR-013,71.7,0.0,ok,línea A
11/01/2026 17:33,SENSOR-046,61.65,2.36,NORMAL,a
2026-01-16 16:35:31,SENSOR-009,29.24,2.877,OK,Linea C
2026-01-16T15:20:05,SENSOR-011,71.28,3.093,0,Linea C
2026-01-21 18:02:11,SENSOR-028,68.21,25.501,Alerta,A
03/01/2026 15:50,SENSOR-017,56.64,9.712,NORMAL,Linea B
2026-01-14T00:42:16,SENSOR-011,48.01,3.35,2,línea C
2026-01-25T16:00:54,SENSOR-025,42.62,4.224,OK,a
2026-01-10T22:45:25,SENSOR-017,"45,54",4.755,OK,Linea B
2026-01-20T12:40:08,SENSOR-039,64.25,3.392,NORMAL,línea B
2025-12-31 21:57:39,SENSOR-004,49.88,2.703,WARN,a
2026-01-09 23:58:30,SENSOR-024,60.09,1.792,OK,línea C
31/12/2025 07:46,SENSOR-007,30.36,0.896,0,Linea C
12/01/2026 09:24,SENSOR-038,62.82,4.402,OK,c
17/01/2026 09:25,SENSOR-010,86.33,0.14,0,Linea B
02/01/2026 11:05,SENSOR-009,28.81,0.137,0,A
2026-01-03 11:02:18,SENSOR-023,57.16,0.21,NORMAL,B
2026-01-19 09:55:26,SENSOR-002,-5.71,3.974,0,línea C
2026-01-02T06:43:28,SENSOR-027,34.63,1.922,OK,Linea B
2026-01-27 09:13:38,SENSOR-029,48.76,1.305,ok,a
2026-01-22 09:05:34,SENSOR-032,36.75,0.104,NORMAL,B
2026-01-10 21:16:41,SENSOR-003,39.83,1.841,WARN,línea A
2026-01-03 05:45:52,SENSOR-006,61.35,4.444,ok,a
06/01/2026 11:09,SENSOR-026,,4.047,OK,B
2026-01-05T08:45:12,SENSOR-015,59.56,0.522,NORMAL,a
2026-01-22 21:57:41,SENSOR-029,33.98,3.114,ok,C
07/01/2026 07:33,SENSOR-043,51.47,4.605,NORMAL,Linea C
2026-01-16T01:21:37,SENSOR-034,34.41,0.196,warning,C
2025-12-30 21:57:20,SENSOR-034,26.75,35.752,OK,Linea A
24/01/2026 10:25,SENSOR-050,59.01,3.488,ok,B
26/01/2026 07:24,SENSOR-038,27.75,3.608,warning,C
2026-01-21T11:30:24,SENSOR-042,34.02,29.166,0,línea B
16/01/2026 18:29,SENSOR-016,44.61,1.046,NORMAL,línea A
30/12/2025 04:39,SENSOR-044,56.43,2.68,fail,c
2026-01-03 04:38:04,SENSOR-015,46.79,1.39,OK,línea C
08/01/2026 10:23,SENSOR-002,51.38,1.66,WARN,Linea A
18/01/2026 09:07,SENSOR-030,72.99,40.793,Alerta,línea A
2026-01-03T05:49:30,SENSOR-017,36.89,25.384,NORMAL,línea B
2025-12-30T14:40:29,SENSOR-036,77.64,1.936,ok,Linea B
2026-01-05T17:33:21,SENSOR-010,,4.292,OK,Linea C
08/01/2026 20:40,SENSOR-007,62.27,3.571,ok,Linea A
31/12/2025 21:53,SENSOR-027,-6.23,2.669,OK,línea C
2026-01-25T18:54:57,SENSOR-031,"76,33",0.973,NORMAL,línea B
11/01/2026 11:03,SENSOR-037,58.04,0.375,NORMAL,línea B
2026-01-01 06:25:04,SENSOR-037,48.17,15.537,1,A
15/01/2026 02:21,SENSOR-010,"50,21",1.849,0,A
2025-12-30 22:47:49,SENSOR-014,29.76,2.222,ok,c
18/01/2026 03:23,SENSOR-021,29.2,3.203,ok,línea A
2026-01-18 01:35:22,SENSOR-042,75.77,3.13,OK,línea A
2026-01-10T20:41:45,SENSOR-009,,3.075,ok,línea A
2026-01-03 02:12:54,SENSOR-023,62.45,1.471,0,C
2026-01-18T13:38:41,SENSOR-048,53.91,0.565,NORMAL,Linea A
2026-01-03T12:52:13,SENSOR-047,27.08,0.0,OK,c
2026-01-21 08:49:19,SENSOR-017,38.35,0.871,ERROR,C
2026-01-15 21:26:37,SENSOR-050,59.41,1.708,OK,a
2026-01-20 13:11:49,SENSOR-011,48.8,1.946,0,Linea A
2026-01-27T03:15:29,SENSOR-044,47.85,4.419,2,B
2026-01-16T21:12:25,SENSOR-045,53.3,1.931,0,B
07/01/2026 17:34,SENSOR-017,70.07,4.193,NORMAL,Linea B
2026-01-11 08:54:25,SENSOR-004,46.67,1.896,ok,línea B
2026-01-16T10:45:20,SENSOR-010,49.9,3.741,Alerta,A
2026-01-25T20:32:43,SENSOR-005,,4.373,0,A
2026-01-02 17:29:46,SENSOR-025,56.4,1.581,ok,a
2026-01-05 06:55:50,SENSOR-048,,1.536,0,Linea A
2026-01-20T17:44:37,SENSOR-001,24.02,2.505,NORMAL,Linea C
22/01/2026 03:03,SENSOR-031,73.09,3.178,ERROR,c
13/01/2026 14:12,SENSOR-012,54.64,4.252,0,B
2026-01-28T02:24:36,SENSOR-020,54.31,1.385,0,B
2026-01-16T01:36:27,SENSOR-021,"25,14",49.926,0,línea B
2026-01-26 17:29:29,SENSOR-049,47.4,1.938,OK,c
2026-01-04 08:41:40,SENSOR-045,59.95,4.681,WARN,Linea A
2026-01-14T07:13:03,SENSOR-008,50.99,3.059,NORMAL,Linea A
05/01/2026 09:52,SENSOR-004,"36,51",2.467,warning,C
2026-01-18 16:05:28,SENSOR-045,65.51,2.824,OK,Linea C
25/01/2026 07:42,SENSOR-003,"43,44",17.192,1,línea B
2026-01-01 23:37:26,SENSOR-007,53.29,1.798,OK,A
07/01/2026 12:13,SENSOR-013,70.28,3.636,fail,línea A
03/01/2026 17:20,SENSOR-033,60.33,0.849,ERROR,B
29/12/2025 21:50,SENSOR-017,78.36,2.514,OK,b
19/01/2026 23:55,SENSOR-044,54.05,0.791,ok,línea C
2026-01-17 05:42:53,SENSOR-030,55.72,0.519,ok,b
2026-01-18T11:57:07,SENSOR-029,39.98,4.7,Alerta,a
2026-01-05 08:26:46,SENSOR-032,41.1,32.199,0,C
2026-01-17 13:01:28,SENSOR-001,109.89,1.334,ok,a
18/01/2026 14:22,SENSOR-008,75.16,1.555,0,A
05/01/2026 08:50,SENSOR-045,43.4,1.384,OK,A
2026-01-17T01:14:14,SENSOR-035,57.09,2.81,ok,Linea A
25/01/2026 23:59,SENSOR-037,27.33,2.719,0,c
2026-01-28 06:42:15,SENSOR-004,16.04,1.872,FAIL,Linea C
2025-12-31 18:49:55,SENSOR-039,"46,0",21.016,Alerta,a
06/01/2026 11:15,SENSOR-029,49.73,2.453,0,A
2026-01-15T06:37:20,SENSOR-002,,2.216,ok,línea B
06/01/2026 10:04,SENSOR-043,"34,69",4.411,NORMAL,c
2026-01-27T09:01:15,SENSOR-021,38.08,0.316,ok,b
2026-01-16 22:12:16,SENSOR-032,41.48,0.807,fail,B
2026-01-27T21:34:01,SENSOR-001,67.6,1.122,0,línea B
29/12/2025 17:01,SENSOR-049,26.63,4.056,OK,a
19/01/2026 18:55,SENSOR-026,"59,7",1.398,ok,a
2026-01-01 03:23:16,SENSOR-026,30.58,0.566,NORMAL,línea A
13/01/2026 19:16,SENSOR-030,31.99,4.993,0,línea A
2026-01-27 17:15:07,SENSOR-049,79.32,3.468,ok,A
2025-12-31T13:12:53,SENSOR-013,62.98,35.126,OK,Linea B
2026-01-12 08:42:50,SENSOR-020,55.54,4.732,WARN,línea B
2026-01-13T13:17:59,SENSOR-025,,0.358,ok,B
11/01/2026 12:32,SENSOR-020,31.55,1.145,FAIL,Linea C
2026-01-07T17:34:56,SENSOR-037,78.4,1.786,FAIL,línea C
21/01/2026 05:45,SENSOR-047,35.32,3.722,NORMAL,b
2026-01-17 12:56:38,SENSOR-039,41.64,2.942,ok,Linea C
2026-01-02T15:47:02,SENSOR-038,31.79,3.544,0,C
08/01/2026 10:37,SENSOR-021,159.18,3.4,NORMAL,b
2026-01-11T16:08:59,SENSOR-004,46.67,1.145,0,a
2026-01-20T21:19:59,SENSOR-001,54.4,4.498,0,Linea B
2026-01-12 11:23:08,SENSOR-035,45.46,2.946,ERROR,línea B
2026-01-07T11:35:20,SENSOR-033,70.1,1.841,fail,línea B
2026-01-19 07:14:24,SENSOR-008,51.19,2.208,ok,b
2026-01-12T19:59:10,SENSOR-003,77.19,2.773,OK,c
2026-01-08 22:30:26,SENSOR-030,41.39,4.296,OK,línea B
2026-01-23T23:03:47,SENSOR-017,57.14,4.285,0,línea C
2026-01-05 08:02:25,SENSOR-047,46.03,4.625,NORMAL,a
2026-01-09 04:08:57,SENSOR-045,144.59,2.49,NORMAL,B
2026-01-26 04:41:48,SENSOR-029,70.17,3.485,NORMAL,A
06/01/2026 01:23,SENSOR-026,"57,84",3.502,OK,línea B
2026-01-15 15:40:24,SENSOR-021,35.79,0.387,ok,línea C
2026-01-01 04:35:28,SENSOR-016,78.05,3.551,WARN,c
29/12/2025 16:43,SENSOR-037,67.69,3.539,NORMAL,C
2026-01-19 20:28:18,SENSOR-015,151.84,0.692,OK,A
2026-01-09 16:03:22,SENSOR-001,74.3,8.453,ok,Linea B
11/01/2026 22:32,SENSOR-019,41.01,2.091,2,Linea A
2026-01-10T01:11:09,SENSOR-020,28.81,0.0,1,a
2026-01-03 18:19:45,SENSOR-003,37.57,1.882,NORMAL,C
2026-01-03 19:06:15,SENSOR-032,27.3,2.986,NORMAL,b
2026-01-18 15:54:22,SENSOR-002,75.27,3.958,1,b
2026-01-04 14:58:21,SENSOR-021,50.27,24.279,ok,Linea A
2026-01-12 00:45:09,SENSOR-001,45.93,4.721,OK,línea B
2026-01-02 17:14:48,SENSOR-004,56.96,0.699,WARN,línea C
2026-01-21 18:42:40,SENSOR-039,51.39,2.665,0,Linea A
2026-01-14T20:59:32,SENSOR-012,45.26,0.0,OK,línea B
2026-01-20T12:31:51,SENSOR-023,"47,83",0.49,OK,B
2026-01-11 06:25:29,SENSOR-040,35.4,2.463,0,A
2026-01-09 18:28:45,SENSOR-015,39.88,2.025,ok,c
2026-01-06 04:31:17,SENSOR-049,68.28,4.535,FAIL,línea C
15/01/2026 15:05,SENSOR-023,32.94,1.582,NORMAL,b
2026-01-23 12:18:41,SENSOR-045,34.28,1.101,OK,Linea B
27/01/2026 13:57,SENSOR-031,72.4,1.951,OK,c
2026-01-10T07:01:05,SENSOR-004,60.43,1.208,OK,B
19/01/2026 12:23,SENSOR-011,,0.51,NORMAL,línea A
19/01/2026 01:07,SENSOR-034,40.29,0.0,0,c
2025-12-29T14:34:00,SENSOR-023,53.38,4.813,0,Linea B
26/01/2026 01:00,SENSOR-029,55.75,1.559,Alerta,línea B
27/01/2026 22:13,SENSOR-041,77.28,3.878,WARN,a
2026-01-05 04:45:14,SENSOR-050,73.9,0.0,OK,Linea B
2026-01-16T08:17:44,SENSOR-001,132.55,2.348,NORMAL,línea A
2026-01-03T01:53:24,SENSOR-021,31.12,1.772,warning,C
16/01/2026 09:47,SENSOR-032,47.84,1.199,NORMAL,Linea A
2026-01-11 18:35:11,SENSOR-027,"68,48",40.315,0,B
13/01/2026 10:22,SENSOR-015,46.89,2.2,ok,a
2026-01-19T19:25:15,SENSOR-020,47.51,3.277,OK,b
2026-01-08 00:35:25,SENSOR-010,36.68,3.274,Alerta,B
2026-01-19T17:58:19,SENSOR-021,78.9,3.933,WARN,Linea A
18/01/2026 00:22,SENSOR-010,"53,69",0.861,0,Linea A
2026-01-08 13:01:07,SENSOR-034,66.32,21.19,FAIL,B
27/01/2026 21:16,SENSOR-045,17.4,0.928,0,a
2025-12-31 01:03:05,SENSOR-003,47.74,38.503,WARN,C
2025-12-30 03:06:45,SENSOR-037,34.65,13.325,NORMAL,línea A
2026-01-02T09:53:02,SENSOR-034,75.78,0.924,ok,a
2026-01-06T13:03:53,SENSOR-038,64.24,2.749,NORMAL,a
2026-01-13T03:39:38,SENSOR-011,69.21,4.893,warning,Linea B
2026-01-18 11:55:35,SENSOR-030,64.68,1.819,0,línea C
2026-01-18 00:32:20,SENSOR-025,67.66,2.964,0,Linea C
2026-01-03T04:20:37,SENSOR-019,74.56,1.617,NORMAL,a
2026-01-14T07:49:19,SENSOR-036,,2.67,NORMAL,C
2026-01-03 14:46:29,SENSOR-007,33.99,2.396,ok,a
2026-01-06 17:35:42,SENSOR-018,50.68,2.819,ok,c
2026-01-10T11:03:08,SENSOR-030,76.76,3.578,NORMAL,a
2026-01-12 16:13:08,SENSOR-028,26.55,40.054,NORMAL,a
09/01/2026 20:54,SENSOR-013,47.07,0.718,WARN,línea C
11/01/2026 00:18,SENSOR-036,,3.887,OK,línea B
2026-01-27T14:52:07,SENSOR-025,"52,23",0.465,OK,línea A
19/01/2026 05:59,SENSOR-019,58.65,0.75,0,línea B
2026-01-08 03:56:45,SENSOR-027,142.03,3.378,Alerta,A
02/01/2026 11:45,SENSOR-050,54.67,2.174,OK,a
2026-01-05T09:09:01,SENSOR-024,60.93,1.65,OK,c
21/01/2026 12:03,SENSOR-041,"65,14",24.612,Alerta,línea C
2026-01-28T09:39:19,SENSOR-022,58.63,47.07,ok,línea C
2026-01-07T11:58:30,SENSOR-027,50.63,2.055,NORMAL,Linea B
01/01/2026 04:23,SENSOR-045,78.78,4.952,ok,a
2026-01-09 09:43:35,SENSOR-023,71.93,3.086,0,Linea C
2026-01-27T09:04:47,SENSOR-037,42.13,3.345,OK,línea C
06/01/2026 18:37,SENSOR-004,40.87,4.558,NORMAL,línea A
2026-01-21 09:26:31,SENSOR-038,"33,62",0.561,OK,b
14/01/2026 17:26,SENSOR-024,35.15,4.75,NORMAL,b
2026-01-12T20:20:25,SENSOR-016,47.98,4.325,0,a
30/12/2025 14:50,SENSOR-004,36.26,0.291,NORMAL,Linea C
05/01/2026 14:42,SENSOR-050,"64,6",1.042,0,b
2026-01-12T08:48:26,SENSOR-048,55.21,1.89,ok,A
11/01/2026 06:43,SENSOR-019,66.71,0.0,0,Linea B
01/01/2026 12:15,SENSOR-042,,2.133,ok,Linea C
2026-01-13 05:39:19,SENSOR-034,64.23,3.863,0,línea A
25/01/2026 17:16,SENSOR-004,30.25,0.965,warning,línea A
2026-01-17 01:22:10,SENSOR-020,57.63,0.874,0,C
2026-01-17T02:03:27,SENSOR-006,"46,58",1.629,NORMAL,Linea C
2026-01-21 23:36:17,SENSOR-007,40.48,1.982,ok,línea C
27/01/2026 17:36,SENSOR-046,67.07,2.902,ok,C
2026-01-02 08:47:05,SENSOR-015,"123,51",2.388,warning,a
2026-01-04T04:41:06,SENSOR-001,,4.2,0,Linea C
30/12/2025 00:38,SENSOR-010,"39,06",3.358,0,línea A
2026-01-27T04:57:13,SENSOR-028,"48,23",13.894,warning,b
2025-12-31T14:49:18,SENSOR-015,86.99,1.455,0,Linea B
2026-01-14T13:09:08,SENSOR-041,"25,44",1.793,Alerta,b
12/01/2026 20:26,SENSOR-031,136.35,2.935,Alerta,A
17/01/2026 05:16,SENSOR-038,38.85,4.153,0,línea C
07/01/2026 03:39,SENSOR-021,163.69,3.984,1,A
2026-01-20T07:56:43,SENSOR-038,79.34,11.689,ok,Linea B
2026-01-26 09:12:38,SENSOR-040,"45,16",32.56,OK,línea B
08/01/2026 03:50,SENSOR-049,32.59,2.701,OK,b
2026-01-10 04:29:06,SENSOR-006,32.8,2.103,Alerta,b
2026-01-17 06:13:47,SENSOR-004,33.81,2.647,OK,línea B
2026-01-04 09:44:02,SENSOR-008,49.39,3.031,ok,c
2026-01-17 01:49:41,SENSOR-010,46.88,4.769,NORMAL,línea A
2026-01-23 05:00:07,SENSOR-022,27.68,3.364,OK,Linea B
2025-12-30 11:26:41,SENSOR-040,44.02,4.468,0,Linea A
2026-01-18T18:13:22,SENSOR-037,85.17,12.704,0,línea A
24/01/2026 21:19,SENSOR-013,76.06,4.956,OK,línea A
2026-01-17T05:08:25,SENSOR-036,"29,68",0.701,NORMAL,c
07/01/2026 09:26,SENSOR-013,78.48,4.521,ok,línea C
24/01/2026 06:06,SENSOR-050,25.18,1.304,0,A
2026-01-07 00:51:10,SENSOR-021,32.21,0.0,NORMAL,Linea C
14/01/2026 13:49,SENSOR-046,78.71,0.668,0,a
10/01/2026 04:04,SENSOR-047,25.38,2.737,ok,c
2026-01-02T05:12:25,SENSOR-003,29.41,3.038,ok,Linea B
2026-01-02T23:41:05,SENSOR-002,"79,55",0.972,Alerta,Linea C
26/01/2026 22:32,SENSOR-044,61.18,1.445,0,b
17/01/2026 10:22,SENSOR-018,43.84,2.146,1,Linea A
2026-01-27T03:14:59,SENSOR-031,65.19,1.905,0,Linea A
2026-01-01 14:33:06,SENSOR-039,"198,26",18.705,ok,A
2026-01-11T13:40:08,SENSOR-050,45.13,0.849,ok,a
2025-12-31T02:31:13,SENSOR-004,52.57,0.0,NORMAL,línea C
2026-01-20 22:47:41,SENSOR-038,64.88,27.812,ok,línea C
09/01/2026 13:03,SENSOR-047,53.43,4.661,ok,Linea C
21/01/2026 04:19,SENSOR-041,71.83,0.842,ok,B
2026-01-15T08:39:24,SENSOR-049,58.95,38.78,NORMAL,C
2026-01-17T21:12:37,SENSOR-008,37.85,9.778,0,Linea B
2026-01-10T03:08:17,SENSOR-018,51.11,3.862,0,A
2026-01-20 04:40:56,SENSOR-047,36.25,4.025,OK,A
20/01/2026 22:13,SENSOR-043,79.09,3.945,NORMAL,línea B
18/01/2026 02:46,SENSOR-017,48.6,0.765,NORMAL,C
2026-01-03T13:56:53,SENSOR-011,52.32,0.0,NORMAL,línea B
2026-01-04T07:43:54,SENSOR-036,45.75,3.129,NORMAL,B
2026-01-21 11:07:44,SENSOR-037,39.67,1.779,OK,A
2026-01-24T04:57:22,SENSOR-022,"199,65",4.581,NORMAL,línea C
2026-01-07T12:28:11,SENSOR-045,"176,94",2.148,0,b
2026-01-10T18:29:29,SENSOR-040,74.82,1.508,ok,línea B
2026-01-11T17:15:45,SENSOR-042,64.71,2.616,ok,línea C
2026-01-17 05:01:29,SENSOR-011,40.41,0.258,OK,Linea B
2026-01-04 12:14:09,SENSOR-001,53.59,34.889,ok,a
08/01/2026 08:00,SENSOR-027,40.32,2.426,OK,línea A
25/01/2026 03:42,SENSOR-035,71.31,1.239,0,A
2026-01-26 02:00:28,SENSOR-002,35.82,3.83,0,A
2026-01-15T22:24:20,SENSOR-035,"59,3",0.907,ok,B
21/01/2026 10:09,SENSOR-027,178.05,27.373,ok,Linea C
2026-01-06T01:29:38,SENSOR-024,39.12,0.0,ok,Linea B
17/01/2026 04:59,SENSOR-010,40.45,2.094,NORMAL,Linea B
2026-01-09T12:03:56,SENSOR-015,52.56,3.756,NORMAL,línea B
2026-01-15 23:10:17,SENSOR-025,70.93,1.009,NORMAL,a
2026-01-03 04:26:59,SENSOR-046,27.15,2.169,ok,línea A
2026-01-13T08:00:51,SENSOR-048,165.05,5.577,fail,Linea C
2025-12-31T08:35:19,SENSOR-042,"69,95",3.737,ok,Linea A
2026-01-02 09:54:42,SENSOR-044,49.59,3.376,0,línea C
17/01/2026 14:24,SENSOR-016,66.51,34.862,0,A
2026-01-20T15:41:45,SENSOR-029,181.1,22.366,NORMAL,a
18/01/2026 09:40,SENSOR-016,"72,25",3.481,OK,A
10/01/2026 05:16,SENSOR-020,40.41,1.467,ok,línea B
2026-01-13T05:27:53,SENSOR-034,156.32,2.683,ok,C
2026-01-04 18:14:31,SENSOR-035,50.4,44.884,OK,a
2026-01-08 06:16:24,SENSOR-024,61.14,4.462,NORMAL,B
2026-01-04 17:10:35,SENSOR-004,69.1,2.609,OK,Linea A
05/01/2026 06:16,SENSOR-040,42.56,4.429,OK,línea C
24/01/2026 14:36,SENSOR-041,43.69,1.557,NORMAL,línea B
02/01/2026 05:29,SENSOR-044,48.74,1.981,OK,línea A
05/01/2026 20:02,SENSOR-038,50.74,39.291,ok,C
09/01/2026 20:54,SENSOR-013,47.07,0.718,WARN,línea C
02/01/2026 12:38,SENSOR-008,59.15,3.718,warning,Linea C
2026-01-15 21:17:28,SENSOR-006,27.14,4.48,OK,Linea A
09/01/2026 21:25,SENSOR-019,68.19,2.752,ok,línea A
2026-01-20 20:55:01,SENSOR-035,62.79,2.96,0,Linea C
2026-01-26T01:18:25,SENSOR-020,64.29,2.725,WARN,línea A
2025-12-31T08:16:43,SENSOR-050,61.09,1.623,NORMAL,c
27/01/2026 12:51,SENSOR-006,46.31,3.24,NORMAL,línea A
2026-01-16T04:35:01,SENSOR-017,38.84,2.341,NORMAL,A
2026-01-19T14:53:44,SENSOR-001,68.48,2.539,NORMAL,Linea C
2026-01-25T09:30:31,SENSOR-032,42.25,11.234,fail,C
27/01/2026 02:25,SENSOR-035,177.68,4.684,0,A
2026-01-18 11:38:56,SENSOR-017,58.2,4.328,OK,línea C
2026-01-05 19:43:20,SENSOR-018,,3.048,WARN,Linea B
2026-01-24T07:11:50,SENSOR-036,32.39,3.051,WARN,a
08/01/2026 15:58,SENSOR-049,"64,49",1.492,ok,Linea C
2026-01-04 12:59:29,SENSOR-023,31.04,3.928,ok,A
2026-01-10 03:43:34,SENSOR-045,167.97,3.362,ok,b
15/01/2026 07:10,SENSOR-043,60.22,10.497,0,A
2026-01-25 16:38:19,SENSOR-023,26.24,2.68,ok,Linea A
2026-01-14T13:37:20,SENSOR-010,98.54,1.718,NORMAL,A
2026-01-07T18:12:36,SENSOR-018,34.48,0.631,OK,línea B
21/01/2026 15:56,SENSOR-007,58.02,2.572,ok,línea B
2026-01-27 18:39:07,SENSOR-009,48.55,4.342,OK,línea A
19/01/2026 05:18,SENSOR-007,49.57,4.108,OK,línea A
19/01/2026 06:26,SENSOR-030,33.96,3.934,OK,línea A
2026-01-23 14:29:37,SENSOR-006,26.39,2.962,NORMAL,Linea B
2026-01-11T02:38:42,SENSOR-023,64.11,24.618,0,Linea A
08/01/2026 06:13,SENSOR-020,57.4,18.14,NORMAL,a
09/01/2026 04:14,SENSOR-035,57.15,1.769,fail,a
2026-01-20T03:23:38,SENSOR-045,33.93,18.586,OK,línea B
2026-01-15T22:15:26,SENSOR-024,78.83,1.235,NORMAL,línea A
30/12/2025 13:06,SENSOR-038,67.15,3.801,NORMAL,línea B
2026-01-26T01:18:25,SENSOR-020,64.29,2.725,WARN,línea A
21/01/2026 04:54,SENSOR-021,77.47,0.289,0,A
2026-01-17 14:00:23,SENSOR-024,43.16,1.293,ok,a
2026-01-21T17:46:08,SENSOR-012,56.29,26.727,OK,B
27/01/2026 22:04,SENSOR-049,35.53,35.037,NORMAL,B
2026-01-19T21:22:22,SENSOR-022,112.25,4.37,ok,c
29/12/2025 23:12,SENSOR-002,164.56,2.52,ok,línea B
2025-12-29T23:08:40,SENSOR-022,,0.0,WARN,línea C
26/01/2026 11:24,SENSOR-047,78.11,0.295,OK,línea C
2025-12-31 02:52:49,SENSOR-037,60.0,4.693,OK,Linea A
31/12/2025 07:08,SENSOR-019,55.94,3.36,0,Linea B
25/01/2026 11:00,SENSOR-033,66.48,4.577,ok,Linea B
2026-01-19T21:25:26,SENSOR-028,26.19,0.841,ok,C
2026-01-01 07:03:14,SENSOR-018,45.6,1.435,OK,Linea C
2026-01-08T11:42:34,SENSOR-004,58.62,3.587,Alerta,c
2026-01-04T03:05:19,SENSOR-025,,1.298,ok,c
2026-01-06T02:31:33,SENSOR-029,62.59,4.648,OK,línea B
2026-01-04 03:04:49,SENSOR-009,184.33,3.912,NORMAL,C
2026-01-05 19:16:43,SENSOR-039,78.97,0.207,NORMAL,línea B
2025-12-30 02:51:45,SENSOR-023,66.75,2.151,ok,línea C
2025-12-31 12:58:01,SENSOR-028,45.88,3.597,ERROR,línea A
2026-01-04T22:36:43,SENSOR-023,70.76,3.434,ok,A
2026-01-08T07:21:25,SENSOR-009,38.94,1.708,0,A
02/01/2026 13:19,SENSOR-002,67.61,0.0,OK,línea A
2026-01-03 08:42:56,SENSOR-006,66.03,0.443,0,línea A
2026-01-27T00:20:02,SENSOR-041,15.87,11.383,0,a
2026-01-20 16:23:55,SENSOR-023,27.5,4.58,0,b
2026-01-15 20:41:55,SENSOR-013,31.57,2.811,1,A
2026-01-18 13:03:49,SENSOR-009,38.57,1.808,2,línea B
2026-01-05T13:40:18,SENSOR-038,"58,77",2.008,0,Linea A
2026-01-11T02:54:36,SENSOR-010,67.4,0.0,0,Linea A
2026-01-12 06:28:02,SENSOR-013,76.09,4.126,NORMAL,a
2026-01-18 05:37:19,SENSOR-009,"66,96",4.597,ok,c
2026-01-08 22:31:35,SENSOR-009,58.86,3.705,WARN,Linea C
19/01/2026 18:55,SENSOR-026,"59,7",1.398,ok,a
24/01/2026 12:26,SENSOR-024,77.45,1.485,0,B
24/01/2026 16:42,SENSOR-020,108.2,4.382,1,c
2026-01-02 17:15:55,SENSOR-044,33.53,0.365,NORMAL,línea A
2026-01-11T23:26:26,SENSOR-005,28.69,4.373,NORMAL,c
14/01/2026 09:46,SENSOR-031,59.43,4.578,0,C
2026-01-23 01:12:35,SENSOR-027,79.34,0.793,1,c
2026-01-02T15:05:07,SENSOR-044,"70,43",19.596,Alerta,C
05/01/2026 02:30,SENSOR-048,72.29,3.607,FAIL,Linea C
2026-01-03 07:56:20,SENSOR-034,48.13,2.748,Alerta,b
24/01/2026 13:12,SENSOR-042,32.97,2.921,ok,Linea B
2026-01-06 09:12:28,SENSOR-014,"71,51",3.868,Alerta,línea B
2026-01-17 03:35:18,SENSOR-006,53.79,30.279,ok,c
2026-01-01 06:47:23,SENSOR-031,75.25,2.98,0,Linea B
2026-01-05T11:21:57,SENSOR-018,59.53,3.382,ERROR,B
2026-01-18 20:31:32,SENSOR-043,65.7,0.316,NORMAL,Linea A
2026-01-09 14:04:22,SENSOR-035,,31.424,OK,línea A
2026-01-09T07:08:14,SENSOR-035,40.43,3.77,1,C
2026-01-24T19:11:40,SENSOR-038,,3.773,NORMAL,A
2026-01-05T13:57:56,SENSOR-036,,1.731,WARN,b
25/01/2026 22:31,SENSOR-032,25.37,0.0,OK,línea A
2025-12-29T20:40:04,SENSOR-017,37.86,0.326,NORMAL,C
2025-12-31 08:21:04,SENSOR-046,41.39,1.83,0,Linea B
2026-01-20 14:10:55,SENSOR-029,29.25,2.046,OK,línea B
06/01/2026 19:39,SENSOR-034,59.5,4.75,NORMAL,a
2026-01-21T14:07:16,SENSOR-039,31.74,2.271,fail,C
2026-01-19T04:29:44,SENSOR-021,62.79,3.552,OK,línea B
2026-01-17T23:38:06,SENSOR-008,62.44,3.288,ok,línea C
13/01/2026 22:31,SENSOR-027,50.49,3.635,0,b
2026-01-05 18:25:34,SENSOR-015,"39,99",1.003,Alerta,línea B
23/01/2026 22:39,SENSOR-002,30.37,2.315,OK,B
2026-01-04 18:29:55,SENSOR-005,78.34,1.112,0,Linea B
2026-01-25 20:56:19,SENSOR-001,73.3,0.285,NORMAL,B
03/01/2026 17:20,SENSOR-033,60.33,0.849,ERROR,B
2026-01-24T05:18:20,SENSOR-041,-3.04,2.708,NORMAL,Linea A
2026-01-04 17:17:15,SENSOR-041,79.32,4.521,0,Linea C
2026-01-11 13:07:05,SENSOR-018,59.09,4.316,OK,línea C
2025-12-30T13:47:04,SENSOR-033,75.88,2.006,NORMAL,línea B
2026-01-21 21:26:46,SENSOR-038,30.12,1.401,ok,línea A
31/12/2025 01:56,SENSOR-032,66.8,5.862,OK,a
01/01/2026 15:29,SENSOR-024,78.59,0.174,NORMAL,B
25/01/2026 10:20,SENSOR-021,39.93,3.174,OK,C
2026-01-10 03:19:55,SENSOR-025,68.19,4.047,0,línea C
14/01/2026 02:32,SENSOR-012,49.51,4.943,NORMAL,Linea A
2026-01-19T09:46:19,SENSOR-011,69.1,0.97,OK,B
2026-01-19T22:35:00,SENSOR-005,64.43,2.041,0,Linea B
2025-12-29T18:14:39,SENSOR-032,"61,07",3.156,1,Linea B
14/01/2026 22:12,SENSOR-030,"57,52",4.065,NORMAL,Linea C
18/01/2026 08:09,SENSOR-031,86.68,0.517,NORMAL,Linea C
27/01/2026 06:55,SENSOR-041,35.73,4.115,ok,c
2026-01-20T05:41:31,SENSOR-033,50.93,16.647,ok,Linea B
2026-01-02T23:50:22,SENSOR-038,74.56,0.72,FAIL,Linea A
27/01/2026 01:14,SENSOR-039,61.36,3.414,NORMAL,línea B
2026-01-24T03:26:54,SENSOR-029,28.75,4.687,warning,c
2026-01-15T10:53:09,SENSOR-024,58.59,3.795,OK,Linea C
2026-01-17 02:56:04,SENSOR-028,"164,47",10.227,ok,B
2026-01-15T18:53:13,SENSOR-045,29.93,4.56,ok,Linea A
2026-01-19T06:55:01,SENSOR-037,37.05,5.566,ok,Linea A
2026-01-24 02:14:33,SENSOR-016,62.34,1.156,ok,línea C
2025-12-31 07:34:46,SENSOR-044,66.66,3.727,OK,b
26/01/2026 14:01,SENSOR-020,"63,83",3.59,OK,c
2026-01-11 19:36:54,SENSOR-025,43.34,42.07,OK,línea B
2026-01-24 09:43:10,SENSOR-031,"54,64",4.114,NORMAL,a
06/01/2026 16:04,SENSOR-004,75.41,2.07,WARN,B
2026-01-13 11:19:14,SENSOR-021,72.47,4.88,0,a
2026-01-06 06:21:49,SENSOR-027,71.87,0.0,ok,C
2026-01-18T09:24:53,SENSOR-047,45.82,1.622,OK,línea A
22/01/2026 11:16,SENSOR-035,40.8,0.202,0,A
12/01/2026 07:17,SENSOR-046,51.17,2.791,Alerta,Linea C
2026-01-02 02:33:25,SENSOR-021,164.78,2.387,0,Linea A
2026-01-12 08:42:45,SENSOR-030,59.84,14.659,0,B
2026-01-02 13:01:45,SENSOR-027,58.07,2.292,1,Linea B
2026-01-28 03:43:21,SENSOR-024,,17.332,warning,B
17/01/2026 01:22,SENSOR-022,,4.588,OK,c
2026-01-14T12:28:19,SENSOR-031,27.7,0.498,NORMAL,Linea B
2026-01-16 05:59:13,SENSOR-023,42.31,23.339,FAIL,Linea A
07/01/2026 16:57,SENSOR-025,30.42,1.666,0,línea B
2026-01-20T15:19:20,SENSOR-009,71.76,4.924,0,Linea A
2026-01-25T11:45:53,SENSOR-018,49.26,1.615,ok,c
2026-01-24T22:55:44,SENSOR-041,28.3,3.006,warning,C
2026-01-17T09:37:29,SENSOR-019,149.64,45.074,ok,Linea B
24/01/2026 12:03,SENSOR-012,36.02,1.538,fail,línea B
15/01/2026 16:42,SENSOR-018,"64,34",23.813,ERROR,Linea B
07/01/2026 02:28,SENSOR-041,45.52,4.107,OK,Linea C
2026-01-04T08:43:33,SENSOR-043,54.21,2.162,2,Linea A
2026-01-05T03:56:08,SENSOR-027,25.43,3.631,0,Linea C
2026-01-17 21:14:46,SENSOR-028,53.13,3.453,ok,C
2026-01-07T20:43:16,SENSOR-014,78.2,1.213,0,a
01/01/2026 05:57,SENSOR-037,79.84,1.94,NORMAL,Linea A
2026-01-24T16:41:19,SENSOR-004,31.02,2.381,ok,línea C
05/01/2026 20:25,SENSOR-004,33.92,4.663,OK,C
2026-01-10T07:03:51,SENSOR-012,43.89,3.75,0,línea C
2026-01-19 10:08:55,SENSOR-037,"45,14",1.275,NORMAL,c
2026-01-07 17:11:53,SENSOR-032,43.21,38.204,1,a
2026-01-14T12:44:47,SENSOR-008,49.8,0.155,0,b
2026-01-25T20:03:28,SENSOR-044,57.94,3.543,Alerta,Linea C
2026-01-19T14:19:42,SENSOR-018,60.45,24.473,warning,línea B
2026-01-06 20:44:51,SENSOR-005,43.91,1.15,ok,línea B
24/01/2026 18:23,SENSOR-011,47.57,0.171,Alerta,línea A
16/01/2026 03:51,SENSOR-047,31.83,3.904,NORMAL,A
20/01/2026 09:42,SENSOR-044,192.75,4.15,NORMAL,C
2026-01-20 04:17:08,SENSOR-020,41.41,3.62,OK,b
2026-01-01 15:13:57,SENSOR-048,58.8,2.633,NORMAL,línea A
2026-01-12 01:07:19,SENSOR-042,61.37,3.883,OK,línea A
2026-01-10T18:29:29,SENSOR-040,74.82,1.508,ok,línea B
2026-01-18 21:53:31,SENSOR-007,32.68,2.784,OK,a
2026-01-02 14:19:36,SENSOR-030,38.4,1.008,ok,Linea A
24/01/2026 23:41,SENSOR-020,50.87,0.59,NORMAL,Linea B
2026-01-02 14:36:05,SENSOR-037,39.15,3.923,WARN,B
2026-01-18 13:09:16,SENSOR-022,67.01,1.49,NORMAL,Linea A
2026-01-12T06:27:56,SENSOR-045,64.82,1.985,2,a
27/01/2026 02:54,SENSOR-038,72.23,1.471,NORMAL,b
24/01/2026 05:56,SENSOR-018,31.0,3.764,ok,C
06/01/2026 15:09,SENSOR-033,55.96,1.496,WARN,B
2026-01-22 11:54:22,SENSOR-020,55.6,3.83,2,línea B
2025-12-31T23:06:33,SENSOR-036,30.12,1.446,OK,A
2026-01-16 18:58:16,SENSOR-001,66.32,1.625,NORMAL,Linea B
2026-01-23T13:56:52,SENSOR-016,29.58,2.713,0,b
2026-01-15 08:20:43,SENSOR-049,55.21,2.107,OK,línea B
2026-01-26T09:55:29,SENSOR-039,61.71,1.118,ok,línea A
2026-01-08 13:33:24,SENSOR-022,53.9,2.472,ERROR,Linea C
07/01/2026 21:08,SENSOR-047,39.43,3.157,NORMAL,a
19/01/2026 00:07,SENSOR-019,70.69,1.128,ok,línea C
2026-01-07T06:37:54,SENSOR-012,38.35,3.347,NORMAL,línea C
2026-01-05 19:44:48,SENSOR-001,61.95,1.623,1,línea C
2026-01-27T18:49:48,SENSOR-004,76.69,4.552,0,C
15/01/2026 10:38,SENSOR-027,65.32,0.0,OK,B
31/12/2025 01:06,SENSOR-049,53.74,0.788,NORMAL,Linea C
14/01/2026 03:35,SENSOR-027,58.05,3.052,warning,línea A
09/01/2026 13:22,SENSOR-004,63.71,2.455,OK,Linea B
2026-01-21 14:26:17,SENSOR-036,157.63,2.338,0,línea C
17/01/2026 08:55,SENSOR-013,39.48,25.236,ok,línea A
2026-01-06T06:52:55,SENSOR-048,52.1,3.283,0,c
2026-01-23T18:11:51,SENSOR-001,31.3,3.074,WARN,A
2026-01-07T05:25:20,SENSOR-006,68.44,1.7,0,Linea B
2026-01-18T13:10:45,SENSOR-017,50.71,1.726,0,Linea B
2026-01-04 21:11:18,SENSOR-032,53.34,4.535,WARN,línea B
31/12/2025 13:27,SENSOR-009,36.62,2.709,NORMAL,C
2026-01-04 22:42:07,SENSOR-032,,1.646,ok,Linea C
2026-01-18T19:12:03,SENSOR-008,194.52,1.541,0,B
2026-01-13 18:39:16,SENSOR-025,57.73,2.969,0,Linea A
2026-01-18 22:49:00,SENSOR-041,65.97,0.356,0,a
2026-01-02T09:19:22,SENSOR-038,53.45,3.567,FAIL,C
03/01/2026 23:16,SENSOR-002,41.07,1.384,ok,B
2025-12-31T20:31:22,SENSOR-049,51.07,3.815,NORMAL,b
2026-01-09T02:27:57,SENSOR-008,46.61,3.592,0,C
05/01/2026 12:01,SENSOR-047,,36.3,Alerta,c
26/01/2026 22:41,SENSOR-043,68.72,1.23,0,a
2026-01-22T20:39:40,SENSOR-034,34.43,4.49,WARN,línea C
21/01/2026 00:16,SENSOR-042,58.17,1.708,OK,c
2025-12-29T16:03:56,SENSOR-013,129.37,3.953,NORMAL,b
2026-01-13 12:53:53,SENSOR-018,45.75,46.246,ok,a
2025-12-29T15:44:27,SENSOR-039,,3.309,WARN,línea B
2026-01-19 22:14:44,SENSOR-005,58.52,0.726,NORMAL,C
2026-01-11 13:18:37,SENSOR-001,41.28,2.692,NORMAL,a
2026-01-03T13:09:22,SENSOR-003,62.78,4.514,OK,B
2026-01-07T07:18:38,SENSOR-036,77.54,0.0,NORMAL,c
07/01/2026 09:50,SENSOR-028,-7.83,0.89,NORMAL,Linea A
27/01/2026 01:50,SENSOR-043,66.06,3.743,OK,A
2025-12-31 02:42:04,SENSOR-043,40.12,1.358,OK,B
2026-01-25 05:55:50,SENSOR-050,163.43,0.534,OK,A
27/01/2026 18:58,SENSOR-013,,4.849,NORMAL,A
2026-01-24 22:46:59,SENSOR-045,57.39,1.936,NORMAL,B
05/01/2026 05:08,SENSOR-028,37.99,3.868,NORMAL,C
24/01/2026 01:34,SENSOR-006,26.83,3.563,NORMAL,B
2026-01-09 08:08:20,SENSOR-015,35.97,29.038,OK,A
23/01/2026 16:12,SENSOR-049,26.81,4.979,0,Linea B
2026-01-02T16:23:47,SENSOR-007,57.74,2.73,2,Linea A
27/01/2026 23:38,SENSOR-045,21.91,1.946,NORMAL,línea A
25/01/2026 04:57,SENSOR-001,61.53,4.79,0,Linea A
2026-01-20T18:44:00,SENSOR-039,46.89,1.965,OK,línea A
23/01/2026 08:10,SENSOR-008,32.5,0.847,Alerta,Linea B
2026-01-15 15:26:11,SENSOR-032,73.98,3.542,NORMAL,c
2026-01-04 05:37:36,SENSOR-023,,1.577,OK,C
2026-01-12T05:15:27,SENSOR-017,,4.042,ok,a
2026-01-03T11:12:51,SENSOR-012,71.68,0.923,0,Linea B
2026-01-22 19:28:07,SENSOR-033,54.67,26.014,2,línea C
2026-01-02 20:36:59,SENSOR-010,60.01,3.769,NORMAL,a
2026-01-02 19:14:54,SENSOR-014,"59,0",3.606,warning,A
2026-01-27T07:28:55,SENSOR-026,"199,15",1.405,Alerta,línea B
15/01/2026 01:06,SENSOR-008,34.93,2.089,NORMAL,Linea B
14/01/2026 20:10,SENSOR-028,28.72,2.432,OK,línea C
14/01/2026 10:27,SENSOR-019,34.39,1.612,0,Linea B
2026-01-13T23:10:44,SENSOR-003,42.3,4.698,ok,línea A
31/12/2025 04:42,SENSOR-023,59.86,4.497,0,B
01/01/2026 02:44,SENSOR-003,31.7,4.039,ok,Linea A
2026-01-12T08:25:21,SENSOR-050,47.07,1.028,ok,línea B
2026-01-12T19:21:12,SENSOR-047,49.61,31.962,1,línea B
2026-01-23 01:06:36,SENSOR-029,,3.636,OK,C
27/01/2026 11:08,SENSOR-046,40.22,3.481,0,línea C
2026-01-23T13:54:37,SENSOR-050,75.12,0.666,OK,línea A
13/01/2026 18:20,SENSOR-020,31.85,4.791,0,línea A
2026-01-03T20:51:59,SENSOR-044,71.88,3.333,OK,a
2026-01-11T01:56:41,SENSOR-048,25.44,0.322,0,c
13/01/2026 01:05,SENSOR-040,43.87,1.871,1,Linea A
2025-12-30 03:34:39,SENSOR-001,49.39,3.747,OK,a
19/01/2026 05:36,SENSOR-014,31.86,1.125,0,A
2026-01-28 01:51:41,SENSOR-004,29.19,3.961,WARN,a
06/01/2026 03:31,SENSOR-012,"50,5",1.577,OK,línea C
2026-01-25T04:37:26,SENSOR-016,69.82,3.908,warning,C
2026-01-09T22:30:30,SENSOR-020,49.17,3.589,NORMAL,línea B
17/01/2026 09:03,SENSOR-021,70.88,4.668,ok,A
2026-01-20 17:24:21,SENSOR-009,,4.827,NORMAL,C
2026-01-15 16:56:32,SENSOR-032,40.37,0.595,WARN,línea A
2026-01-14T12:06:13,SENSOR-040,26.71,47.438,OK,línea B
2026-01-03T15:23:20,SENSOR-022,41.13,3.586,ok,línea A
2026-01-01 15:13:57,SENSOR-048,58.8,2.633,NORMAL,línea A
25/01/2026 12:19,SENSOR-035,70.32,1.624,0,c
2026-01-21 23:55:27,SENSOR-022,59.48,0.367,0,a
13/01/2026 09:34,SENSOR-009,,3.509,NORMAL,Linea B
2026-01-10T11:36:28,SENSOR-040,40.33,45.449,OK,línea C
02/01/2026 14:00,SENSOR-032,30.11,3.528,warning,b
2026-01-16T17:37:04,SENSOR-003,44.2,0.818,NORMAL,Linea B
21/01/2026 23:19,SENSOR-010,66.87,3.509,NORMAL,Linea A
2026-01-25T06:31:43,SENSOR-008,127.54,27.267,NORMAL,c
12/01/2026 05:08,SENSOR-020,59.04,23.24,0,a
2026-01-06T21:21:53,SENSOR-048,31.29,4.373,NORMAL,C
2026-01-02 16:12:09,SENSOR-033,79.33,0.668,OK,A
01/01/2026 19:19,SENSOR-042,73.72,4.403,OK,A
2026-01-05 04:42:03,SENSOR-041,65.84,2.254,NORMAL,B
2026-01-15T22:58:12,SENSOR-017,-5.18,4.125,OK,Linea A
2026-01-14T10:53:17,SENSOR-021,51.28,3.144,OK,a
19/01/2026 11:44,SENSOR-018,78.89,4.235,FAIL,Linea A
24/01/2026 20:03,SENSOR-022,123.79,2.366,ok,a
2026-01-25T02:56:28,SENSOR-037,52.67,1.614,NORMAL,línea B
09/01/2026 13:31,SENSOR-025,,3.713,NORMAL,B
2026-01-20T02:05:23,SENSOR-006,73.09,39.765,ok,línea A
04/01/2026 12:49,SENSOR-023,51.23,2.373,NORMAL,a
13/01/2026 10:27,SENSOR-004,61.86,0.352,ok,c
2026-01-27 08:07:39,SENSOR-005,64.36,3.788,OK,a
2026-01-10 16:13:00,SENSOR-048,25.98,2.721,NORMAL,B
21/01/2026 08:29,SENSOR-044,62.27,2.428,NORMAL,Linea B
2026-01-21 02:13:28,SENSOR-048,67.62,0.479,ok,b
2026-01-23T01:51:29,SENSOR-033,52.96,38.838,warning,línea B
16/01/2026 08:08,SENSOR-041,38.4,2.376,OK,B
2026-01-21 00:30:40,SENSOR-038,32.36,6.485,0,C
2026-01-27T02:04:37,SENSOR-031,34.21,0.995,fail,c
2026-01-12T00:39:07,SENSOR-007,,3.034,warning,b
2026-01-04 14:37:21,SENSOR-040,78.94,2.311,Alerta,línea B
09/01/2026 21:10,SENSOR-003,43.32,4.799,OK,C
2026-01-15T11:24:47,SENSOR-005,52.19,1.205,OK,b
2026-01-16 12:09:01,SENSOR-007,78.54,3.248,WARN,Linea B
2026-01-08T19:06:24,SENSOR-001,192.14,1.115,FAIL,Linea C
2026-01-18 01:06:38,SENSOR-008,,3.313,ok,línea A
2026-01-04 08:36:12,SENSOR-017,43.22,0.896,OK,línea A
2026-01-01 15:45:09,SENSOR-039,56.06,4.475,NORMAL,línea C
05/01/2026 00:26,SENSOR-009,42.82,4.27,ok,Linea B
2026-01-21T18:48:36,SENSOR-008,50.34,4.067,NORMAL,b
2026-01-17 15:39:05,SENSOR-001,43.72,0.623,NORMAL,A
2026-01-22T16:53:40,SENSOR-006,72.67,3.894,ok,A
14/01/2026 08:53,SENSOR-032,51.08,3.351,0,c
20/01/2026 17:51,SENSOR-034,,3.618,ok,A
03/01/2026 14:56,SENSOR-049,64.61,3.746,0,a
2026-01-10T18:41:44,SENSOR-012,53.74,3.765,0,Linea B
2026-01-21 01:50:01,SENSOR-047,55.43,0.0,NORMAL,línea B
20/01/2026 20:05,SENSOR-049,150.1,0.686,NORMAL,b
04/01/2026 00:51,SENSOR-017,74.0,2.353,ok,a
2026-01-01T12:48:14,SENSOR-002,41.98,1.276,1,A
2026-01-07 18:54:05,SENSOR-038,59.71,4.999,NORMAL,a
2026-01-06 06:09:50,SENSOR-015,46.78,3.777,0,línea B
18/01/2026 09:53,SENSOR-036,78.81,0.271,OK,b
29/12/2025 20:05,SENSOR-032,61.08,3.025,NORMAL,B
2026-01-18 10:11:27,SENSOR-026,32.29,1.808,OK,a
2026-01-10 14:54:44,SENSOR-009,41.64,0.462,0,A
2026-01-23T00:11:21,SENSOR-016,54.69,35.281,ok,línea A
2026-01-17T22:30:54,SENSOR-025,59.08,0.796,OK,b
24/01/2026 00:40,SENSOR-039,68.8,4.942,0,línea C
15/01/2026 11:40,SENSOR-028,67.75,46.647,OK,Linea B
2026-01-27T02:38:03,SENSOR-001,154.38,3.868,OK,C
28/01/2026 01:34,SENSOR-008,72.3,2.775,OK,línea C
2026-01-27T03:57:08,SENSOR-044,59.07,3.108,ok,C
2026-01-10 01:13:22,SENSOR-046,57.33,13.516,ok,Linea A
2026-01-27T08:45:35,SENSOR-009,73.53,3.178,0,Linea B
2026-01-21 17:07:27,SENSOR-033,28.24,1.905,ok,Linea A
2026-01-26 16:51:16,SENSOR-035,,4.687,1,línea A
2026-01-25 22:21:10,SENSOR-024,63.32,1.472,0,B
2026-01-18T13:31:46,SENSOR-009,43.16,4.528,NORMAL,C
2026-01-09T07:23:29,SENSOR-028,26.32,1.532,ok,línea B
25/01/2026 11:30,SENSOR-050,29.41,1.249,0,A
2025-12-31 01:19:41,SENSOR-011,54.11,2.664,warning,línea C
2026-01-23T23:17:38,SENSOR-017,55.17,10.172,WARN,c
29/12/2025 14:16,SENSOR-050,25.67,4.191,NORMAL,línea B
2026-01-10T14:37:02,SENSOR-038,41.43,1.955,WARN,c
2026-01-03 15:04:05,SENSOR-050,79.11,3.374,0,C
2026-01-18T00:00:43,SENSOR-009,31.3,2.621,NORMAL,línea A
2026-01-26T10:04:33,SENSOR-015,63.63,1.095,OK,A
2026-01-05 01:49:28,SENSOR-021,67.74,4.885,NORMAL,línea B
2026-01-18T07:33:12,SENSOR-049,30.41,2.031,ok,línea C
2026-01-16T02:43:04,SENSOR-036,50.29,2.543,Alerta,c
06/01/2026 09:45,SENSOR-026,68.0,4.866,OK,B
2026-01-03 07:19:36,SENSOR-018,46.98,0.207,Alerta,Linea A
2026-01-14T11:46:08,SENSOR-028,"70,36",0.426,WARN,línea C
2026-01-14 01:29:07,SENSOR-006,"44,73",4.935,0,Linea B
2026-01-28T08:44:54,SENSOR-037,,4.534,0,Linea A
14/01/2026 21:36,SENSOR-008,30.63,1.646,ok,línea A
2026-01-07T11:12:05,SENSOR-044,58.05,2.631,0,B
2026-01-06 23:06:57,SENSOR-049,,4.976,0,línea C
2025-12-30T07:56:00,SENSOR-024,"76,27",2.592,ok,a
31/12/2025 08:11,SENSOR-050,44.76,1.195,OK,línea B
2025-12-31 05:27:50,SENSOR-004,"58,49",3.646,0,A
20/01/2026 07:27,SENSOR-029,"53,68",2.944,WARN,b
2026-01-26 17:14:06,SENSOR-011,39.5,2.719,NORMAL,b
2026-01-25 15:10:27,SENSOR-011,68.01,0.0,NORMAL,línea C
14/01/2026 15:54,SENSOR-041,46.93,3.274,1,B
2025-12-30 17:34:19,SENSOR-011,78.84,41.131,ok,línea A
2026-01-27T09:24:53,SENSOR-042,79.2,0.132,OK,línea C
2026-01-28 07:14:57,SENSOR-012,60.25,0.193,Alerta,línea A
13/01/2026 15:52,SENSOR-045,37.14,1.696,OK,B
2026-01-16 17:58:31,SENSOR-007,71.27,2.449,ERROR,a
2026-01-13 23:05:34,SENSOR-045,72.42,2.821,0,C
02/01/2026 05:45,SENSOR-014,67.54,2.359,0,línea B
06/01/2026 09:30,SENSOR-017,60.94,3.349,0,Linea A
2026-01-08 12:30:08,SENSOR-021,60.66,3.553,NORMAL,Linea B
2026-01-10 21:06:49,SENSOR-010,41.94,32.888,NORMAL,línea A
17/01/2026 03:10,SENSOR-024,32.84,1.554,1,Linea A
2026-01-15T03:45:15,SENSOR-035,74.63,2.461,ok,b
2026-01-25 06:01:12,SENSOR-033,43.87,0.471,0,a
2026-01-04T21:15:21,SENSOR-047,68.68,26.516,NORMAL,a
15/01/2026 18:37,SENSOR-025,56.32,3.575,0,C
2026-01-27T16:30:41,SENSOR-033,50.69,2.648,OK,Linea C
05/01/2026 19:31,SENSOR-047,53.26,4.444,2,A
2026-01-03T11:56:15,SENSOR-031,71.65,4.734,ok,b
06/01/2026 13:14,SENSOR-021,64.64,0.717,NORMAL,B
2026-01-16T23:07:18,SENSOR-036,63.02,1.233,ok,C
02/01/2026 05:29,SENSOR-044,48.74,1.981,OK,línea A
2025-12-30T23:32:39,SENSOR-019,69.0,1.175,0,línea B
2026-01-08T13:59:13,SENSOR-008,63.93,3.799,0,línea B
2026-01-14T00:07:56,SENSOR-035,51.83,0.0,FAIL,línea B
2025-12-30T09:14:07,SENSOR-017,59.94,4.861,NORMAL,a
2026-01-12T20:43:45,SENSOR-033,40.42,4.138,NORMAL,Linea B
25/01/2026 06:36,SENSOR-008,39.95,1.273,ok,línea C
09/01/2026 09:02,SENSOR-018,86.05,2.129,NORMAL,línea B
2026-01-09T02:51:09,SENSOR-001,50.65,0.284,NORMAL,B
2026-01-08 03:23:04,SENSOR-031,66.23,0.0,0,c
2026-01-14T21:51:33,SENSOR-044,74.02,2.174,NORMAL,b
2026-01-09 08:44:57,SENSOR-018,42.62,0.386,NORMAL,a
16/01/2026 08:37,SENSOR-025,38.82,0.4,ok,Linea B
2026-01-20 10:18:26,SENSOR-009,61.63,1.247,FAIL,Linea B
2026-01-01 21:55:35,SENSOR-007,44.75,3.488,warning,Linea C
2026-01-18T14:19:06,SENSOR-038,123.2,3.488,0,línea C
2026-01-25 13:17:07,SENSOR-028,52.05,1.272,0,línea B
2026-01-03T18:49:33,SENSOR-006,"67,57",0.666,0,Linea A
2026-01-27 17:58:45,SENSOR-011,34.55,2.224,OK,b
2026-01-06 01:38:05,SENSOR-036,104.83,2.904,Alerta,Linea A
13/01/2026 19:01,SENSOR-002,63.12,2.4,ok,C
08/01/2026 10:49,SENSOR-044,79.86,2.733,warning,línea B
18/01/2026 10:35,SENSOR-038,65.38,2.946,NORMAL,A
18/01/2026 06:44,SENSOR-046,60.76,4.686,ok,línea B
12/01/2026 14:22,SENSOR-008,38.31,4.777,NORMAL,a
2026-01-19 15:17:33,SENSOR-004,45.52,4.481,OK,A
2026-01-20T22:40:08,SENSOR-018,25.56,3.975,OK,b
2026-01-15 06:35:15,SENSOR-050,43.6,1.163,NORMAL,a
2026-01-15 14:13:34,SENSOR-017,48.31,4.14,ok,c
2026-01-24 14:38:11,SENSOR-007,"55,29",1.029,OK,Linea A
2026-01-08 03:31:04,SENSOR-004,142.01,15.318,OK,a
2026-01-13T04:56:49,SENSOR-029,49.78,3.46,NORMAL,c
16/01/2026 20:32,SENSOR-049,25.66,4.907,OK,línea A
2026-01-24 06:59:30,SENSOR-026,41.34,4.844,ok,línea A
21/01/2026 10:09,SENSOR-027,178.05,27.373,ok,Linea C
11/01/2026 03:59,SENSOR-012,37.12,3.696,ok,C
09/01/2026 01:46,SENSOR-003,48.05,3.261,0,línea A
13/01/2026 06:13,SENSOR-032,113.64,0.104,NORMAL,C
24/01/2026 00:37,SENSOR-009,58.94,0.656,NORMAL,b
15/01/2026 23:58,SENSOR-038,"30,27",39.812,0,línea B
2026-01-17 18:26:16,SENSOR-001,75.8,2.974,OK,Linea C
2026-01-25 08:30:50,SENSOR-013,68.02,3.636,ok,b
15/01/2026 01:51,SENSOR-042,40.54,4.791,0,Linea B
2026-01-14 09:02:49,SENSOR-002,"61,65",3.26,0,línea C
2026-01-07T03:39:41,SENSOR-035,79.08,3.03,ok,b
25/01/2026 22:00,SENSOR-046,38.92,3.901,ok,Linea A
2026-01-13T05:11:01,SENSOR-009,42.94,4.601,NORMAL,A
2026-01-06 15:46:05,SENSOR-035,65.37,0.889,ok,línea B
2026-01-01 23:29:56,SENSOR-002,134.54,4.139,ok,A
03/01/2026 17:37,SENSOR-021,70.55,4.81,1,A
13/01/2026 05:29,SENSOR-035,24.96,2.582,NORMAL,Linea A
2026-01-02T18:03:30,SENSOR-004,"62,35",0.18,ok,c
2026-01-18 15:08:45,SENSOR-025,47.34,4.472,NORMAL,c
09/01/2026 06:32,SENSOR-038,33.92,3.351,OK,línea A
2025-12-31T11:44:08,SENSOR-050,73.71,0.367,ok,Linea B
2026-01-22T06:27:30,SENSOR-033,41.67,3.997,ok,b
2026-01-24 01:21:43,SENSOR-017,47.42,2.522,OK,B
2026-01-09 02:15:53,SENSOR-042,75.46,2.466,ok,b
2026-01-11T13:29:38,SENSOR-044,33.35,2.116,NORMAL,Linea A
2026-01-27T08:39:57,SENSOR-029,79.81,0.14,0,b
2026-01-18 09:29:50,SENSOR-037,55.12,2.755,ERROR,Linea C
2026-01-11T08:37:24,SENSOR-020,54.01,11.889,0,línea A
2026-01-19 15:05:25,SENSOR-045,38.05,3.684,OK,C
2026-01-27T03:07:20,SENSOR-026,44.48,2.189,WARN,c
2026-01-03 15:24:54,SENSOR-026,50.66,3.452,1,Linea A
2026-01-25T17:06:55,SENSOR-001,162.25,0.601,NORMAL,Linea A
2026-01-05 13:45:31,SENSOR-016,42.36,0.0,NORMAL,B
2026-01-28 04:13:36,SENSOR-028,29.79,16.134,NORMAL,Linea A
2026-01-14T03:14:05,SENSOR-007,44.46,4.624,1,Linea C
03/01/2026 19:15,SENSOR-025,"146,6",5.32,0,Linea C
2026-01-17T18:39:39,SENSOR-014,36.01,2.425,ok,B
29/12/2025 13:37,SENSOR-046,78.35,2.422,ok,A
26/01/2026 23:42,SENSOR-022,78.12,2.897,NORMAL,A
2026-01-28 01:55:40,SENSOR-023,63.24,3.025,ok,b
2026-01-21T18:31:42,SENSOR-008,25.01,3.676,NORMAL,C
2026-01-05T18:58:24,SENSOR-035,,2.49,WARN,a
2025-12-30T12:08:14,SENSOR-047,48.42,4.815,OK,línea C
20/01/2026 06:40,SENSOR-012,26.48,0.675,OK,C
25/01/2026 11:19,SENSOR-040,65.65,2.873,0,C
2026-01-12 18:09:54,SENSOR-050,14.45,2.878,0,línea B
2026-01-09T20:40:14,SENSOR-023,"64,72",1.784,NORMAL,A
2026-01-03 22:51:06,SENSOR-050,77.59,4.18,OK,C
2025-12-30 20:31:16,SENSOR-010,46.78,2.253,ok,b
11/01/2026 07:34,SENSOR-035,70.71,3.031,OK,b
2026-01-05 12:44:29,SENSOR-033,52.52,0.614,ok,línea C
13/01/2026 23:45,SENSOR-029,48.81,4.674,0,a
2026-01-22T19:43:18,SENSOR-016,39.33,4.802,NORMAL,línea B
16/01/2026 18:31,SENSOR-015,77.43,1.609,0,Linea B
31/12/2025 08:44,SENSOR-027,"53,33",1.284,ok,c
2026-01-17T11:04:17,SENSOR-013,27.74,3.164,NORMAL,A
2026-01-14T11:37:41,SENSOR-015,76.47,0.606,OK,línea B
2025-12-29T22:37:06,SENSOR-020,65.81,0.326,NORMAL,línea A
2026-01-20T08:20:46,SENSOR-022,30.55,4.812,ok,c
01/01/2026 02:19,SENSOR-028,49.67,3.377,ok,C
03/01/2026 01:48,SENSOR-016,77.81,0.169,WARN,Linea A
2026-01-24T20:59:07,SENSOR-003,75.48,1.148,NORMAL,línea B
16/01/2026 16:15,SENSOR-003,44.24,1.818,0,línea A
2026-01-19 16:20:45,SENSOR-017,77.28,1.91,NORMAL,línea A
2026-01-23T00:24:39,SENSOR-048,58.24,1.487,WARN,b
10/01/2026 17:39,SENSOR-017,54.44,3.018,Alerta,Linea A
31/12/2025 01:48,SENSOR-014,59.91,4.459,Alerta,c
05/01/2026 06:26,SENSOR-013,41.34,4.586,0,B
2026-01-17T07:37:23,SENSOR-037,5.9,2.496,0,Linea B
2025-12-29 22:41:11,SENSOR-027,,4.538,OK,a
2026-01-10T02:11:45,SENSOR-041,44.91,0.229,0,A
2026-01-23T15:35:54,SENSOR-017,37.69,0.0,WARN,A
2026-01-04 02:11:53,SENSOR-011,36.95,0.83,0,A
2026-01-13T22:48:26,SENSOR-034,,46.612,ok,línea C
24/01/2026 07:18,SENSOR-045,66.21,1.636,0,b
31/12/2025 20:54,SENSOR-005,66.14,1.884,ok,línea B
2026-01-24T20:59:07,SENSOR-003,75.48,1.148,NORMAL,línea B
2026-01-07T07:22:35,SENSOR-039,73.99,2.251,0,línea B
31/12/2025 01:52,SENSOR-013,79.24,2.745,0,C
2026-01-12T11:39:58,SENSOR-044,174.19,2.444,ok,b
2026-01-14T14:27:56,SENSOR-033,51.31,18.626,ok,c
2026-01-12T05:09:38,SENSOR-039,27.09,0.881,0,línea C
2026-01-07 18:56:37,SENSOR-045,"40,7",4.335,Alerta,Linea A
2026-01-01 04:11:12,SENSOR-007,64.25,3.221,WARN,c
11/01/2026 00:43,SENSOR-009,45.84,4.788,0,C
2026-01-20T17:39:27,SENSOR-025,57.26,1.167,1,B
2026-01-16 14:20:21,SENSOR-047,44.02,0.833,NORMAL,C
2026-01-05T11:15:57,SENSOR-038,64.39,2.982,ok,línea B
2026-01-15T10:58:22,SENSOR-034,30.15,2.651,0,Linea B
2026-01-16T09:28:07,SENSOR-043,48.41,15.496,0,línea C
11/01/2026 03:11,SENSOR-043,"46,58",4.833,WARN,Linea B
2026-01-13 11:42:43,SENSOR-011,36.81,36.01,OK,a
2026-01-09T20:12:21,SENSOR-046,59.31,1.643,FAIL,B
2026-01-09T00:04:03,SENSOR-033,"36,76",26.438,NORMAL,Linea C
2026-01-09 00:35:04,SENSOR-050,38.3,2.166,WARN,c
2026-01-17T15:25:54,SENSOR-038,40.65,2.528,ok,C
2026-01-21T01:03:27,SENSOR-017,85.88,3.35,FAIL,Linea B
2026-01-23T05:08:45,SENSOR-030,57.7,1.883,0,Linea A
09/01/2026 20:50,SENSOR-014,"61,66",4.035,0,línea B
31/12/2025 21:43,SENSOR-039,39.91,0.0,OK,B
2026-01-14 00:13:36,SENSOR-033,38.51,42.274,ok,Linea C
2026-01-14 13:49:43,SENSOR-023,48.08,1.067,ok,línea B
2026-01-07T22:06:09,SENSOR-022,44.0,4.149,ERROR,c
2026-01-13 03:11:59,SENSOR-004,26.26,2.725,0,línea A
2026-01-15 09:09:04,SENSOR-009,,3.252,warning,A
31/12/2025 17:01,SENSOR-017,,4.974,ERROR,C
2026-01-08T17:47:29,SENSOR-029,53.63,0.552,NORMAL,Linea A
30/12/2025 08:08,SENSOR-017,68.09,0.0,ok,b
2026-01-10 21:22:46,SENSOR-034,25.66,0.0,NORMAL,línea C
2026-01-20 13:52:14,SENSOR-005,71.01,4.831,OK,Linea A
2026-01-09 16:35:36,SENSOR-022,,19.705,NORMAL,c
2026-01-11 22:28:52,SENSOR-031,68.58,4.454,NORMAL,Linea A
2026-01-06T21:52:49,SENSOR-033,49.42,1.096,ok,b
2026-01-21 09:42:24,SENSOR-050,62.75,2.544,0,A
2026-01-09 13:40:04,SENSOR-048,73.06,4.904,FAIL,a
2026-01-22 21:51:58,SENSOR-001,"34,77",3.31,0,C
12/01/2026 22:36,SENSOR-049,46.95,22.478,NORMAL,a
2026-01-10 03:19:55,SENSOR-025,68.19,4.047,0,línea C
2026-01-05 04:15:52,SENSOR-014,177.15,3.714,WARN,línea C
12/01/2026 11:53,SENSOR-001,79.85,1.216,2,C
2026-01-18 05:10:36,SENSOR-036,"34,8",0.0,ok,línea A
2025-12-31T20:34:43,SENSOR-046,38.1,3.385,0,b
2026-01-07 20:30:15,SENSOR-002,53.88,4.015,ok,línea C
2026-01-04T12:20:06,SENSOR-021,68.79,2.268,0,A
2025-12-31 16:44:18,SENSOR-032,"34,09",1.217,NORMAL,línea C
2026-01-04T19:08:34,SENSOR-036,75.78,0.226,ok,Linea B
2026-01-14 23:53:54,SENSOR-035,"62,57",1.379,ok,B
15/01/2026 15:48,SENSOR-016,"58,31",0.895,FAIL,Linea A
2026-01-24 15:04:07,SENSOR-024,70.76,2.898,OK,Linea B
2026-01-09 08:44:57,SENSOR-018,42.62,0.386,NORMAL,a
19/01/2026 11:11,SENSOR-049,36.53,1.111,0,Linea B
24/01/2026 14:05,SENSOR-005,149.44,3.095,OK,c
20/01/2026 03:57,SENSOR-014,69.86,3.764,NORMAL,a
2026-01-12T17:43:37,SENSOR-001,55.1,15.943,0,línea A
03/01/2026 23:06,SENSOR-050,96.24,2.354,NORMAL,C
2026-01-26 05:39:21,SENSOR-028,41.52,49.301,1,línea C
2025-12-31T06:53:25,SENSOR-006,56.36,4.232,OK,A
12/01/2026 00:00,SENSOR-035,"50,65",45.712,1,A
2026-01-07 15:23:52,SENSOR-024,"61,03",3.043,WARN,b
10/01/2026 09:01,SENSOR-019,35.38,0.0,NORMAL,C
2026-01-02T12:18:11,SENSOR-008,33.49,0.548,0,línea A
03/01/2026 22:41,SENSOR-032,45.85,4.01,0,B
2026-01-06T19:48:58,SENSOR-047,68.43,2.529,2,línea C
2026-01-26T05:38:39,SENSOR-037,48.76,27.955,ok,línea A
18/01/2026 04:22,SENSOR-042,"70,28",41.35,0,línea A
01/01/2026 13:38,SENSOR-015,137.7,0.283,NORMAL,Linea A
25/01/2026 06:18,SENSOR-017,74.56,0.618,2,c
2026-01-25T17:28:27,SENSOR-038,37.52,4.888,0,Linea C
2025-12-31T12:46:32,SENSOR-028,73.44,0.283,ok,línea A
27/01/2026 12:23,SENSOR-033,52.13,2.879,0,b
2026-01-08 08:34:04,SENSOR-036,,4.928,1,línea C
26/01/2026 07:51,SENSOR-032,188.35,2.172,0,C
2026-01-16T17:35:15,SENSOR-012,57.23,0.211,OK,línea C
09/01/2026 18:46,SENSOR-011,56.84,3.035,OK,a
27/01/2026 20:31,SENSOR-035,48.67,2.198,FAIL,b
2026-01-07T16:46:27,SENSOR-010,65.39,2.811,OK,C
2026-01-04T18:55:45,SENSOR-004,67.48,2.756,0,a
2025-12-31T23:29:39,SENSOR-005,58.34,4.416,ok,a
2026-01-23T19:22:19,SENSOR-038,31.66,0.656,0,B
02/01/2026 14:50,SENSOR-019,69.76,1.893,OK,c
21/01/2026 18:07,SENSOR-022,66.34,0.0,0,b
2026-01-06T14:16:40,SENSOR-007,47.01,2.102,warning,Linea A
2026-01-23T05:39:44,SENSOR-008,74.93,1.714,0,a
28/01/2026 07:46,SENSOR-047,68.43,2.175,FAIL,Linea C
2025-12-30T21:30:17,SENSOR-013,65.11,0.0,0,Linea B
02/01/2026 02:48,SENSOR-022,58.08,1.414,NORMAL,c
2026-01-17 00:31:43,SENSOR-007,"27,52",23.314,OK,Linea B
2026-01-22 16:36:54,SENSOR-020,35.08,2.856,OK,B
31/12/2025 00:38,SENSOR-037,74.49,2.798,warning,línea C
21/01/2026 13:14,SENSOR-002,25.68,0.0,ok,C
02/01/2026 06:31,SENSOR-028,76.55,3.209,ok,Linea C
2026-01-17T23:08:28,SENSOR-047,"46,25",40.8,NORMAL,línea A
2026-01-17T21:19:04,SENSOR-044,27.96,3.94,1,línea A
2025-12-31T08:43:42,SENSOR-012,76.28,2.116,Alerta,B
22/01/2026 16:31,SENSOR-008,30.4,3.612,ok,Linea B
2026-01-11 05:55:09,SENSOR-035,60.35,4.932,OK,Linea A
07/01/2026 03:09,SENSOR-043,70.19,2.432,0,Linea C
29/12/2025 19:03,SENSOR-016,66.59,1.149,OK,c
2026-01-18 22:55:26,SENSOR-034,58.35,3.423,ok,línea C
04/01/2026 05:38,SENSOR-038,34.96,42.66,ok,B
2026-01-08 16:51:19,SENSOR-027,87.91,2.126,0,B
26/01/2026 01:00,SENSOR-005,35.27,14.552,ok,Linea A
2026-01-06 13:35:52,SENSOR-017,107.43,0.564,ok,a
2026-01-09T14:36:58,SENSOR-010,42.0,2.908,NORMAL,línea B
2026-01-15T18:34:26,SENSOR-017,51.35,3.985,NORMAL,A
11/01/2026 01:38,SENSOR-028,49.82,4.855,NORMAL,B
12/01/2026 09:10,SENSOR-037,"27,04",3.033,NORMAL,B
2026-01-13 23:16:00,SENSOR-021,120.48,2.898,ok,b
29/12/2025 22:53,SENSOR-043,61.18,3.053,OK,Linea C
11/01/2026 02:45,SENSOR-029,67.39,2.314,ok,C
2025-12-30T21:38:39,SENSOR-044,,4.43,ok,b
2026-01-18 11:54:08,SENSOR-021,"46,27",4.925,NORMAL,c
2026-01-06 00:24:38,SENSOR-001,,2.214,OK,Linea B
03/01/2026 05:24,SENSOR-034,33.47,16.483,OK,Linea C
2026-01-08T16:58:57,SENSOR-036,74.41,4.994,NORMAL,línea B
2026-01-02 08:56:20,SENSOR-048,,3.19,OK,a
2026-01-02T14:20:04,SENSOR-007,70.06,3.119,OK,C
16/01/2026 22:42,SENSOR-020,"30,85",2.616,Alerta,línea C
2026-01-07 17:12:43,SENSOR-045,"54,11",4.413,ok,C
2026-01-27T21:08:05,SENSOR-008,61.88,26.257,ERROR,línea C
2026-01-10T19:39:50,SENSOR-018,66.07,49.642,NORMAL,línea A
2026-01-14 06:29:20,SENSOR-044,78.13,3.116,0,línea B
2026-01-22 21:37:22,SENSOR-015,61.34,2.781,0,línea B
2026-01-15T02:24:56,SENSOR-001,59.77,3.109,ok,b
23/01/2026 16:49,SENSOR-003,47.62,27.085,NORMAL,C
2026-01-13T22:10:28,SENSOR-046,56.9,3.547,NORMAL,Linea C
09/01/2026 03:31,SENSOR-034,32.61,1.321,ok,línea C
2026-01-24 07:44:00,SENSOR-005,45.23,1.182,NORMAL,Linea C
2026-01-20T23:35:40,SENSOR-027,40.29,0.557,ok,Linea A
2026-01-20 00:05:04,SENSOR-010,26.33,2.596,OK,a
2026-01-05T16:15:32,SENSOR-007,26.32,3.141,ok,línea A
2026-01-20 15:39:14,SENSOR-045,75.12,0.0,NORMAL,Linea A
2026-01-27T06:49:09,SENSOR-043,28.41,0.509,0,Linea A
18/01/2026 17:22,SENSOR-016,27.1,2.926,Alerta,c
03/01/2026 15:56,SENSOR-038,65.79,1.944,NORMAL,línea C
2026-01-22 18:38:33,SENSOR-029,25.26,0.921,1,A
30/12/2025 18:09,SENSOR-041,31.92,3.618,0,b
2026-01-17T16:48:38,SENSOR-050,50.49,2.794,Alerta,B
2025-12-31 11:10:01,SENSOR-045,64.44,3.781,0,b
2026-01-02 04:10:16,SENSOR-047,77.98,1.025,0,línea A
05/01/2026 02:53,SENSOR-015,37.68,46.118,ok,A
2026-01-12 01:51:09,SENSOR-003,50.31,4.376,0,a
2026-01-01 06:29:19,SENSOR-042,79.24,2.382,NORMAL,Linea B
2026-01-26 02:01:46,SENSOR-042,52.83,1.209,NORMAL,C
2026-01-05 09:05:19,SENSOR-003,"70,69",0.684,0,Linea B
2026-01-25T01:11:37,SENSOR-012,37.0,3.673,0,línea A
2025-12-30T15:52:06,SENSOR-009,"180,47",3.673,OK,Linea C
2026-01-16T11:57:58,SENSOR-009,59.94,0.991,0,C
2026-01-13T22:12:42,SENSOR-022,42.06,4.018,NORMAL,a
2026-01-02T07:37:32,SENSOR-008,50.29,0.613,2,B
18/01/2026 13:35,SENSOR-002,5.57,2.985,Alerta,Linea C
2026-01-10 06:07:52,SENSOR-023,,3.971,OK,a
16/01/2026 04:35,SENSOR-048,"67,69",3.201,WARN,línea C
2026-01-16T18:48:41,SENSOR-050,,0.0,fail,C
2026-01-13 07:19:24,SENSOR-037,79.02,1.775,0,Linea A
23/01/2026 16:53,SENSOR-024,57.78,0.958,ok,B
2026-01-25 05:39:55,SENSOR-017,"174,98",0.269,NORMAL,línea B
12/01/2026 16:31,SENSOR-010,74.48,0.428,NORMAL,Linea B
2026-01-09 12:47:33,SENSOR-025,76.91,3.839,0,línea C
2026-01-22 05:36:32,SENSOR-010,61.67,4.647,OK,línea A
05/01/2026 15:53,SENSOR-042,60.6,0.721,ok,línea A
2026-01-19 06:59:42,SENSOR-050,48.08,4.122,0,a
2026-01-18 06:18:12,SENSOR-039,25.4,49.619,Alerta,A
2026-01-21T01:54:39,SENSOR-001,"43,61",0.767,0,a
23/01/2026 06:47,SENSOR-033,76.57,3.686,NORMAL,b
09/01/2026 10:14,SENSOR-013,47.24,2.566,0,a
16/01/2026 18:58,SENSOR-040,28.33,4.904,Alerta,c
31/12/2025 04:59,SENSOR-040,34.97,0.835,ok,Linea B
29/12/2025 22:34,SENSOR-003,79.11,0.543,OK,C
2026-01-24T20:10:11,SENSOR-033,29.67,4.305,OK,línea B
25/01/2026 17:47,SENSOR-047,31.51,2.064,warning,c
2026-01-15T07:33:40,SENSOR-013,54.22,2.422,1,Linea B
2026-01-26T00:34:15,SENSOR-002,,46.868,OK,B
12/01/2026 21:04,SENSOR-037,58.4,1.68,WARN,línea B
30/12/2025 11:30,SENSOR-036,66.63,3.975,NORMAL,línea B
12/01/2026 17:41,SENSOR-007,89.25,3.454,ok,Linea A
16/01/2026 09:43,SENSOR-029,78.22,2.193,ok,línea B
2026-01-14T09:18:34,SENSOR-026,56.52,2.896,NORMAL,B
2026-01-19T00:30:17,SENSOR-031,28.17,3.088,0,Linea A
20/01/2026 08:51,SENSOR-012,66.37,1.44,0,Linea C
2026-01-07 21:52:39,SENSOR-040,"45,07",3.852,ok,línea A
05/01/2026 15:17,SENSOR-010,26.12,0.735,warning,línea A
13/01/2026 10:22,SENSOR-015,46.89,2.2,ok,a
2026-01-06 06:07:17,SENSOR-007,62.57,3.445,1,c
2026-01-09 10:25:17,SENSOR-021,"141,57",3.243,0,A
02/01/2026 05:00,SENSOR-001,73.14,1.135,OK,B
10/01/2026 16:47,SENSOR-033,29.63,0.0,ok,a
2025-12-30T01:16:42,SENSOR-023,42.65,1.97,NORMAL,c
2026-01-03 15:58:38,SENSOR-048,35.6,18.672,ok,b
2026-01-24T11:30:52,SENSOR-031,54.2,2.688,0,b
13/01/2026 10:22,SENSOR-015,46.89,2.2,ok,a
2025-12-29T17:08:13,SENSOR-042,55.77,1.827,NORMAL,C
2026-01-20 18:56:25,SENSOR-017,25.91,3.982,ok,Linea C
12/01/2026 02:29,SENSOR-012,63.07,1.436,OK,b
2026-01-13 19:47:22,SENSOR-037,64.78,0.0,0,a
26/01/2026 03:18,SENSOR-037,"31,08",0.0,ok,b
2026-01-03 08:40:26,SENSOR-028,41.13,0.335,NORMAL,línea C
17/01/2026 09:10,SENSOR-048,,3.398,2,B
10/01/2026 05:48,SENSOR-006,"58,21",3.236,warning,Linea C
2026-01-24 23:26:28,SENSOR-007,74.66,42.719,Alerta,línea C
2026-01-09 10:10:04,SENSOR-025,30.85,4.688,WARN,línea A
16/01/2026 21:34,SENSOR-044,63.48,0.0,WARN,línea B
2026-01-24T04:36:15,SENSOR-048,46.57,1.486,0,Linea A
2026-01-14 10:49:30,SENSOR-035,44.14,2.261,NORMAL,c
2026-01-09T06:44:45,SENSOR-037,,0.865,NORMAL,A
2026-01-08T11:06:41,SENSOR-031,35.91,1.301,WARN,Linea B
19/01/2026 21:21,SENSOR-033,147.43,0.122,OK,línea A
07/01/2026 06:21,SENSOR-029,37.07,0.724,OK,a
2026-01-14 05:33:14,SENSOR-024,28.58,0.134,NORMAL,c
08/01/2026 03:17,SENSOR-013,35.15,3.387,ok,B
2026-01-07T23:43:42,SENSOR-013,,4.504,Alerta,línea C
06/01/2026 16:03,SENSOR-023,70.86,42.962,WARN,A
2026-01-21 05:00:17,SENSOR-038,78.29,0.21,OK,Linea A
09/01/2026 20:49,SENSOR-020,160.14,4.942,ERROR,línea A
04/01/2026 08:11,SENSOR-025,164.17,4.716,ok,línea B
15/01/2026 07:51,SENSOR-024,31.78,4.62,ok,línea B
2026-01-16 06:18:45,SENSOR-004,76.78,0.551,NORMAL,Linea A
2025-12-30T07:22:24,SENSOR-005,77.87,49.057,0,A
27/01/2026 22:19,SENSOR-006,75.95,2.283,OK,b
2026-01-26 10:05:36,SENSOR-005,32.16,0.0,fail,línea C
2026-01-23T01:55:02,SENSOR-014,54.72,1.633,Alerta,c
2026-01-22 20:32:22,SENSOR-016,66.11,1.803,ok,línea A
2026-01-21T18:09:42,SENSOR-032,7.08,3.22,0,Linea A
2026-01-22T06:16:21,SENSOR-043,39.25,2.815,Alerta,línea A
2026-01-19T17:02:29,SENSOR-038,54.59,2.744,NORMAL,línea A
2026-01-28T08:32:09,SENSOR-004,37.24,4.411,WARN,c
2026-01-27T19:55:27,SENSOR-030,"73,31",0.553,warning,Linea C
07/01/2026 09:26,SENSOR-010,29.44,4.905,2,Linea B
21/01/2026 14:58,SENSOR-024,65.7,1.364,ok,B
01/01/2026 12:23,SENSOR-012,71.38,4.687,ok,Linea B
16/01/2026 22:50,SENSOR-041,"42,74",2.956,NORMAL,C
2026-01-24T09:45:30,SENSOR-036,64.26,3.259,NORMAL,B
2026-01-21T08:03:32,SENSOR-028,27.77,1.389,ok,línea B
2026-01-06 19:39:40,SENSOR-024,44.61,2.297,OK,línea C
2026-01-09T04:27:25,SENSOR-019,38.94,2.974,ok,a
2026-01-12 16:26:56,SENSOR-049,40.23,3.183,2,línea C
2026-01-27T22:57:37,SENSOR-016,70.86,0.112,0,línea B
2026-01-14 23:14:32,SENSOR-015,55.15,3.658,ok,c
2026-01-27 08:22:58,SENSOR-013,69.85,1.039,OK,A
02/01/2026 18:32,SENSOR-042,67.06,0.0,ok,a
2026-01-10 16:19:30,SENSOR-033,64.51,4.091,NORMAL,A
31/12/2025 02:06,SENSOR-028,25.15,0.957,OK,Linea B
2025-12-30 14:36:02,SENSOR-015,50.33,3.235,OK,línea B
2026-01-25T07:14:24,SENSOR-019,152.65,2.944,OK,B
2026-01-10T21:47:31,SENSOR-020,39.47,1.46,ok,b
2025-12-31T23:57:00,SENSOR-012,72.29,4.33,ok,A
2026-01-17 03:21:21,SENSOR-019,"61,25",3.465,warning,A
27/01/2026 10:56,SENSOR-027,193.31,9.306,0,c
2026-01-03 07:03:40,SENSOR-034,56.19,0.146,OK,Linea B
2026-01-02 11:26:37,SENSOR-002,58.38,0.932,0,c
2026-01-20T23:35:40,SENSOR-027,40.29,0.557,ok,Linea A
2026-01-04 12:46:49,SENSOR-014,"76,41",33.039,0,línea C
2026-01-06 00:26:27,SENSOR-024,"44,92",4.401,NORMAL,línea C
2025-12-31 22:03:45,SENSOR-038,69.56,3.238,warning,Linea A
2026-01-09 03:12:29,SENSOR-041,42.61,4.0,ok,C
29/12/2025 22:55,SENSOR-048,63.77,2.162,FAIL,línea A
2025-12-29 12:04:02,SENSOR-002,61.76,2.155,NORMAL,Linea A
2026-01-17 01:20:48,SENSOR-030,25.2,4.954,1,línea C
2026-01-13 03:16:24,SENSOR-021,61.94,3.924,0,B
2026-01-01T18:14:12,SENSOR-040,33.42,1.794,1,línea C
2026-01-11 19:57:49,SENSOR-025,31.49,0.189,FAIL,C
2026-01-04T21:21:37,SENSOR-033,51.1,0.32,NORMAL,línea C
2026-01-08 03:30:28,SENSOR-028,,4.123,WARN,b
05/01/2026 15:18,SENSOR-033,60.45,0.0,ok,B
31/12/2025 13:05,SENSOR-005,151.5,4.919,OK,A
2026-01-26T11:02:19,SENSOR-011,41.63,3.476,fail,B
16/01/2026 06:40,SENSOR-029,"65,92",4.384,0,b
2026-01-11T10:29:50,SENSOR-010,,1.567,NORMAL,c
27/01/2026 15:08,SENSOR-033,"42,88",45.398,WARN,b
05/01/2026 07:32,SENSOR-046,66.17,3.201,OK,c
2026-01-18 09:26:51,SENSOR-023,47.54,3.721,OK,C
2026-01-01 11:18:50,SENSOR-016,73.17,4.95,ok,línea B
13/01/2026 11:26,SENSOR-028,66.38,0.72,NORMAL,Linea A
2026-01-06 09:09:09,SENSOR-018,67.36,18.11,ok,b
16/01/2026 11:21,SENSOR-032,58.87,0.947,OK,Linea A
2026-01-18T11:26:24,SENSOR-017,71.45,4.64,OK,c
2026-01-03 07:56:20,SENSOR-034,48.13,2.748,Alerta,b
2026-01-27 15:08:46,SENSOR-013,33.28,1.759,OK,Linea C
2026-01-06 22:18:58,SENSOR-036,26.67,1.138,OK,línea A
2026-01-07T22:59:51,SENSOR-011,52.04,3.5,NORMAL,c
2026-01-02 10:43:45,SENSOR-049,76.41,24.982,NORMAL,línea C
2026-01-19T09:33:06,SENSOR-021,50.02,4.568,OK,C
2026-01-26T16:03:21,SENSOR-020,50.04,0.0,NORMAL,C
2026-01-02T18:24:06,SENSOR-034,64.88,4.08,0,línea A
2025-12-31T02:49:04,SENSOR-007,52.59,0.536,NORMAL,línea B
10/01/2026 11:45,SENSOR-050,17.37,1.194,OK,Linea C
13/01/2026 03:08,SENSOR-024,46.66,0.12,0,línea A
2026-01-17 17:27:30,SENSOR-013,27.64,0.177,NORMAL,línea B
20/01/2026 19:46,SENSOR-045,47.24,4.971,1,Linea A
05/01/2026 20:11,SENSOR-011,75.17,4.588,OK,b
2026-01-12 12:58:57,SENSOR-005,28.4,0.666,ok,C
31/12/2025 15:32,SENSOR-001,79.57,4.196,OK,b
04/01/2026 03:26,SENSOR-045,"34,2",29.493,0,Linea C
15/01/2026 11:11,SENSOR-013,187.0,0.798,0,C
2026-01-08T20:07:11,SENSOR-049,72.87,4.041,ok,A
31/12/2025 12:35,SENSOR-043,55.62,12.496,OK,línea A
2026-01-04T11:24:25,SENSOR-040,"58,68",1.05,OK,línea A
2025-12-31 00:07:42,SENSOR-033,36.95,2.151,FAIL,A
2026-01-21T05:42:13,SENSOR-050,76.14,1.46,warning,línea B
2026-01-13 00:03:12,SENSOR-029,"73,85",18.168,NORMAL,b
2026-01-15 20:38:56,SENSOR-014,"99,23",3.403,OK,Linea B
2026-01-24T22:03:04,SENSOR-017,67.94,0.118,OK,A
2026-01-13 05:36:00,SENSOR-018,51.4,4.506,WARN,a
2026-01-05 00:59:25,SENSOR-036,69.36,2.819,0,línea B
23/01/2026 16:39,SENSOR-016,33.47,3.867,warning,línea C
2026-01-21 15:18:09,SENSOR-039,55.7,4.251,ok,línea B
2026-01-09 07:56:29,SENSOR-024,60.88,3.507,NORMAL,C
2026-01-12T18:28:05,SENSOR-040,25.22,0.0,ERROR,B
2026-01-20 12:54:12,SENSOR-015,94.85,4.651,OK,C
2026-01-12 19:43:46,SENSOR-045,60.5,4.032,0,Linea A
05/01/2026 00:18,SENSOR-016,79.72,0.102,OK,C
2026-01-19 18:34:16,SENSOR-004,36.48,0.832,OK,b
17/01/2026 16:38,SENSOR-038,25.74,2.88,NORMAL,línea B
2026-01-12T12:04:04,SENSOR-003,51.96,2.916,NORMAL,B
13/01/2026 07:37,SENSOR-010,176.24,0.0,FAIL,c
2026-01-25 04:01:32,SENSOR-041,59.99,3.695,0,a
2026-01-12 04:26:38,SENSOR-030,35.09,0.489,fail,C
2026-01-16 15:48:20,SENSOR-043,40.27,3.716,NORMAL,B
07/01/2026 01:03,SENSOR-008,50.81,47.028,WARN,c
2026-01-22 14:24:19,SENSOR-035,61.6,0.585,WARN,A
2026-01-15 10:20:54,SENSOR-039,58.11,36.844,NORMAL,línea A
2026-01-08 10:15:55,SENSOR-036,62.15,1.167,OK,Linea B
31/12/2025 12:46,SENSOR-042,78.64,3.643,NORMAL,C
2026-01-16T04:25:05,SENSOR-032,"61,27",34.13,ok,B
2025-12-30T13:02:20,SENSOR-011,34.38,4.676,OK,línea A
2025-12-30 03:14:04,SENSOR-040,51.41,4.239,warning,C
2026-01-19T03:06:46,SENSOR-030,"29,76",3.215,ok,Linea C
2026-01-07T17:00:38,SENSOR-023,53.48,4.006,1,C
09/01/2026 13:22,SENSOR-004,63.71,2.455,OK,Linea B
04/01/2026 11:50,SENSOR-032,27.89,1.926,0,B
2026-01-23T17:54:22,SENSOR-021,65.67,0.0,ok,línea A
02/01/2026 19:53,SENSOR-035,42.76,3.506,OK,c
2026-01-25T23:48:22,SENSOR-026,25.5,1.901,0,línea A
2025-12-31T01:21:33,SENSOR-030,40.1,3.485,fail,Linea B
2026-01-21 19:51:06,SENSOR-018,53.78,3.728,OK,línea B
2026-01-21 00:34:32,SENSOR-049,71.57,1.748,OK,c
2026-01-20T09:57:40,SENSOR-007,39.41,43.601,OK,línea A
2026-01-17T10:16:15,SENSOR-014,74.25,1.914,NORMAL,línea A
12/01/2026 05:50,SENSOR-047,40.52,39.502,NORMAL,B
2026-01-24T13:10:34,SENSOR-041,26.72,3.67,ok,línea A
22/01/2026 23:13,SENSOR-018,25.83,30.283,warning,línea C
2026-01-26 04:04:01,SENSOR-014,76.16,1.637,OK,C
11/01/2026 15:57,SENSOR-002,53.66,1.586,OK,Linea B
2026-01-03 15:03:33,SENSOR-030,35.12,0.0,OK,línea B
2025-12-31T16:58:45,SENSOR-006,37.41,46.535,NORMAL,C
2026-01-25T10:09:42,SENSOR-050,,3.325,NORMAL,a
2026-01-02 08:47:05,SENSOR-015,"123,51",2.388,warning,a
30/12/2025 11:20,SENSOR-029,53.82,1.526,OK,a
08/01/2026 14:02,SENSOR-008,41.26,0.758,ok,línea C
03/01/2026 13:08,SENSOR-031,27.74,4.362,Alerta,a
2025-12-29T13:50:20,SENSOR-010,78.67,2.458,OK,Linea A
24/01/2026 02:40,SENSOR-019,"67,7",0.606,OK,C
2026-01-01 22:07:24,SENSOR-030,,13.017,0,Linea C
2026-01-07 19:48:28,SENSOR-036,,0.0,Alerta,Linea B
2026-01-07 05:05:02,SENSOR-039,,1.919,NORMAL,línea B
2026-01-15 13:43:12,SENSOR-049,39.16,41.805,NORMAL,B
28/01/2026 03:06,SENSOR-039,47.51,2.87,Alerta,a
2026-01-01T04:54:06,SENSOR-014,55.71,4.701,NORMAL,a
2026-01-04T21:13:53,SENSOR-017,62.52,4.087,ok,Linea C
16/01/2026 12:14,SENSOR-018,63.51,1.458,OK,A
2026-01-21 05:24:46,SENSOR-013,63.36,0.291,ok,línea C
10/01/2026 06:39,SENSOR-045,30.66,1.456,OK,Linea A
2026-01-16 18:57:23,SENSOR-021,79.92,0.958,ok,línea B
2026-01-28T02:36:31,SENSOR-030,53.42,4.627,ok,línea B
2026-01-04 09:51:11,SENSOR-022,60.24,3.534,ok,c
2025-12-31 21:46:50,SENSOR-002,41.79,3.971,fail,línea A
2026-01-01T20:49:16,SENSOR-043,33.05,18.083,ok,Linea B
2026-01-05 13:36:25,SENSOR-010,49.66,4.596,ok,B
05/01/2026 05:13,SENSOR-031,66.05,1.938,ERROR,C
2025-12-31T16:29:30,SENSOR-014,54.32,4.563,ok,c
17/01/2026 12:06,SENSOR-003,49.34,2.865,ok,Linea C
2025-12-29T10:08:34,SENSOR-037,72.64,4.048,ok,Linea B
30/12/2025 16:18,SENSOR-006,50.71,2.319,OK,línea A
2026-01-09 16:04:37,SENSOR-037,41.9,0.441,ok,línea A
2026-01-21 18:40:32,SENSOR-008,33.26,4.104,2,B
2026-01-23 06:22:19,SENSOR-018,30.65,3.027,ok,línea A
24/01/2026 19:30,SENSOR-008,76.49,0.307,OK,B
2026-01-11 11:38:38,SENSOR-043,76.59,2.616,0,línea B
2026-01-09T13:29:13,SENSOR-033,53.83,0.879,ok,línea B
16/01/2026 05:56,SENSOR-012,198.21,2.497,OK,línea B
15/01/2026 23:39,SENSOR-009,67.56,1.635,0,línea C
21/01/2026 13:48,SENSOR-020,,2.583,NORMAL,C
2026-01-03 23:06:16,SENSOR-050,32.38,4.454,Alerta,C
2026-01-21T04:58:23,SENSOR-038,79.73,14.614,ok,c
2026-01-10T00:46:17,SENSOR-007,43.07,4.273,1,a
2026-01-07 20:45:16,SENSOR-003,51.05,3.215,FAIL,B
2026-01-08T10:48:11,SENSOR-036,71.74,3.293,OK,c
2026-01-10T04:04:58,SENSOR-010,67.11,4.071,OK,B
09/01/2026 14:14,SENSOR-006,52.18,2.63,ok,Linea B
2026-01-24T17:56:59,SENSOR-034,76.74,1.553,fail,B
2026-01-06T14:31:32,SENSOR-048,30.71,3.777,warning,línea C
2026-01-06T04:11:50,SENSOR-049,32.64,0.685,0,c
2026-01-22 01:35:28,SENSOR-019,70.77,2.768,NORMAL,c
